,text
0,http nflsuperbowlgamel com http nflsuperbowlgamel com http nflsuperbowlgamel com http nflsuperbowlgamel com http nflsuperbowlgamel com http nflsuperbowlgamel com
1,audibl much best holi bull remov
2,lebron jame say ask cavali make trade
3,everton ademola lookman score great goal leipzig gladbach remov
4,juara liga hampir tersisa harapan untuk madrid
5,ad hbh live stream final big bash leagu 2017 adelaid striker hobart hurrican sports24houronlin
6,mario lemina want southampton build west bromwich albion win remov
7,domin respect sport prime tiger prime serena prime jordan remov feder gretzki bradman jordan appropri debat prime feder lightyear beyond prime serena comparison wood unstopp serena far solo sport hard compar athlet team way win tiger serena definit would say jordan final win pretti sheit team believ lebron final oppon better rate jordan prime tyson delet consist mayb absolut peak serena domin make sens get roll one could ever stop meanwhil feder lost plenti time even play best tenni guy like nadal djokov think serena ever lost play best dunno bradman may impress stat ever overal think gretzki nadal hand second best player ever fed match sampra slam feder got past number rafa got ahead feder serena never real competit never real competit especi got pound muscl player wta tour
8,yuzvendra chahal comment kedar jadhav bowl action twitter split
9,superbowl like christma anymor tri avoid deal hope asap remov titlegor abl enjoy christma superbowl sad life life sad enjoy thing fuck sad
10,zlatan ibrahimov biopic film work delet
11,nhận định bóng trận crystal palac newcastl ngài
12,lombo speed victori robert lewi remov
13,rocket embarrass lebron disconnect cav 120
14,nhận định bóng liverpool tottenham 23h30 ngài
15,stephen curri chang tupac
16,دعوت امیر عابدزاده تیم ملی فوتبال ایران
17,pictur nintendo labo event nintendo store remov
18,roger scoreboard feb 2018
19,prediksi benevento napoli febuari 2018
20,back futur remad today delet
21,goalkeep yusif moro complet berekum chelsea move remov
22,prediksi augsburg frankfurt
23,american relay set indoor world record millros game
24,end bathurst hour race race suspend declar cleanup accid would taken minut remain driver walk away accid although ash walsh driver stationari car hit seem need time climb car jeez saw car came rest knew troubl blind fast corner amaz porsch miss big hit walsh end suspect broken rib possibl punctur lung plu side lead class final classifi lap get trophi next hospit bed need stink flag favourit guy marc mazda third car drift car miss park audi thousandth inch
25,domin green hit game win buzzer beater huski upset arizona love uconn washington fan think huski huski least northeastern know better
26,prediksi udines milan febuari 2018
27,sourav ganguli tell book mahendra singh dhoni stori one know
28,superbowl like christma anymor tri avoid deal hope asap
29,bat bowl cricket
30,prediksi skor la palma malaga februari 2018
31,four beginn parkour trick delet
32,speed franco get head gidu dania beach remov
33,bow trump pass tricki protocol test japanes emperor
34,کدام تیمها ثبات ترین حریفان برانکو پرسپولیس هستند
35,валентина шевченко пустила кровь бразильянке присцилы качоэйра жесть
36,win adelaid striker hobart hurrican final big bash leagu match predict 4th februari 2018 ad hbh final bbl match bet tip
37,cara memilih bandar judi piala dunia terpercaya
38,رکورد خارق العاده راموس تساوی مقابل لوانته جای گذاشت
39,live score india ind south africa
40,sun stitch arsen aubameyang tri hit martina wechsung gold lamborghini remov
41,top best catch month januari 2018 mind blown
42,babo conquer kozlova win taipei citi championship remov
43,childhood career achiev life pogba
44,visitor aim seri
45,hdjo2016riodejaneiro2014coupedumondefootballthomasanciauxmondetvwebspor
46,ciri kha agen ceme indonesia
47,oat vic open georgia hall finish joint third melbourn remov
48,adelaid striker hobart hurrican big bash leagu final match 2018
49,man citi west ham flop set stamford bridg move remov
50,میزبانی دوحه انتخاب عمان سوی afc فرصتی برای فدراسیون ایران شکایت فیفا سعودی تهران کشاند
51,adelaid striker hobart hurrican big bash leagu final match 2018
52,adelaid striker hobart hurrican big bash leagu final match 2018
53,ind rsa live broadcast soni ten soni ten channel sports24houronlin
54,forev unbridl post first breez 2018 remov
55,nick kyrgio break racquet tantrum davi cup
56,نیمار صبرانه برای بازی مقابل رئال مادرید لحظه شماری کنم
57,renato sanch thought go man unit chelsea remov
58,big bash leagu final adelaid striker hobart hurrican cricket
59,rahul dravid great mentor say shahid afridi india win
60,mahendra singh dhoni virat kohli hilari exchang caught stump mic
61,espnliv remov
62,carson wentz highschool delet
63,stapac unggul ata garuda bandung ibl seri vii
64,http superbowlwatchl com
65,prediksi skor paderborn bayern munchen februari 2018
66,carson wentz highschool take footbal jersey look like one readi steal lunch money team high school patriot iron look like kid version jim halpert ident theft joke jim michael
67,tacchinardi back manag cont role model remov
68,rocket embarrass lebron disconnect cav 120
69,sharma shoot win malaysia westwood fade remov
70,maradona legend centuri
71,ioana chira bodi posit awesom plu size model big leg butt romania
72,chelsea olivi giroud didier deschamp told leav arsen remov
73,tri learn rule american footbal time superbowl
74,derek jeter receiv joe dimaggio icon award
75,peculiar nine element ratio display
76,prediksi sgp senin februari 2018
77,virat kohli team hail victori world cup winner
78,чемпионат города шахты мини футболу 2018 год
79,zlatan ibrahimov movi come remov
80,yuzvendra chahal dismantl south africa five
81,prediksi sydney senin februari 2018
82,mark bosnich call daniel arzani cap anoth impress show remov
83,found sport best athlet
84,ball man 42m kick ireland grab win insan bore game minut becam amaz
85,watch puppi bowl dog bowl kitten bowl
86,jake weatherald rapid fire ton help adelaid striker clinch maiden big bash leagu titl
87,ted cheeseman defeat carson jone
88,box could face expuls game ioc warn delet
89,best super bowl predict remov
90,prediksi nampho senin februari 2018
91,prediksi nairobi senin februari 2018
92,prediksi dakar senin februari 2018
93,fear everton cenk tosun arsen remov
94,yuzvendra chahal kuldeep yadav star visitor beat protea wicket
95,александра емельяненко нокаутировали чечне
96,زهر شفر پادزهر قلعه نویی دلیل تعویض زودهنگام ذوب آهن بود
97,australian open 2018 funniest moment delet
98,prediksi sino senin februari 2018
99,sharma win second european tour titl malaysia
100,watch superbowl lii 2018 australia
101,coach amp train women academi spotlight mona valstad els
102,juventu sassuolo confirm line up live updat remov
103,prediksi porto senin februari 2018
104,rather see bradi win anoth titl terrifi eagl fan never shut win remov hope bane show end smishmort root tie end meteor strike would rather see histori year old see eagl win anyth scottish realli get hate bradi bradi hater stand see win anoth ring petti reason pick anoth win ring would rodger bree whoever choic bradi hate pat love deni eagl fan satisfact win rather see bradi win anoth titl period giant fan cannot wors matchup hope massiv flu outbreak philli let bird hope eagl win patriot get caught act cheat ref call forfeit fuck fuck dalla bird actual read articl right defens govt sound like think might best scenario heard far best ever play think opinion either coach almost univers hate sport 7th time go super bowl caught cheat multipl time playoff tom bradi go like ancient footbal player still best leagu skill offset much peopl dislik never gone first super bowl fumbl god damn ball ref invent tuck rule spot gave patriot game whole dynasti built lie also rate passer game matt cassel could liter make throw go expos much bradi would differ team belijerk system bunch cheat bradi person get tire see player team alway win would appli rodger packer bree saint catch parad though hahaha typic eagl fan pull eagl man wish arrog could tone back know great probabl greatest time understand hate good kind hate kind respect behind rememb uproar inflat ball realli understand cheat guess somehow make easier catch make easier throw pinpoint accuraci caught cheat lol deflateg caught cheat peopl actual believ spygat film signal unapprov angl peopl make seem like patriot bug oppos team stadium stole game plan tape signal anyon els see actual 8th time go superbowl even crazi superbowl far loss giant come man hate patriot delud enough say matt cassel would bradi posit right rather one great want pariti tire see jordan win ring think anyon would say nonsens even difficult footbal swallow pride lose let get constant media coverag like even watch footbal feel like constantli bombard tom bradi shit eventu get tire hear great tom bradi patriot hate come mix multipl alleg cheat plu win everi year inflat ball realli affect accuraci much chang small allow littl extra oomph throw rememb lot hate bradi come eagl fan past coupl week without doubt insuffer fanbas nfl patriot probabl cheat colt dolphin jet etc goe mani team caught pump crowd nois stadium spi team practic hey big propon whole noth dirti cheater narr certainli tri cut everi corner could actual like tom bradi feel like watch histori play good age play well 40 think pretti awesom pro year well never know truth bradi play anywher els agre disagre ye want pariti fan sport nba fan sure would tire see jordan bull domin 90 well demonstr fals patriot tri cut corner cheat team nfl googl search easili valid let take extrem would rather new team win championship everi year everi team eventu ring everyon sing kumbaya hold hand mayb particip award everyon play cool much rather see new team championship win championship team win play nearli everi season
105,super bowl lii predict
106,толчок гири одной рукой домашняя тренировка гирями
107,dirk nowitzki continu reward dalla maverick loyalti even approach pleas retir dirk watch run anymor make sad one best efg year career peopl call retir clearli watch season retir great season grand end career broke bone retir hospit peopl smartass clearli know talk
108,امیر کابوس استقلال بازی امتیاز
109,prediksi sisilia senin februari 2018
110,buy ticket psl 2018 pakistan super leagu 2018
111,newcastl fan rage graem souness crystal palac remov
112,transcript evolut network benefit busi today
113,bat bowl cricket delet
114,prediksi jersey senin februarii 2018
115,india crush south africa nine wicket lead seri
116,اطلاعیه فدراسیون فوتبال خصوص بلیت های جام جهانی
117,india cruis victori chahal put south africa spin sport
118,dishonest neymar blame rise transfer fee barcelona chief remov
119,prediksi bromo senin februari 2018
120,قوچان نژاد اسم پسرم دوران گذاشتیم لحظه دنیا آمدم فرزندم گریه کردم
121,england itali rugbi live stream six nation februari stadio olimpico
122,bcci websit offlin domain renew
123,offens coordin frank reich certain ring
124,bigger bicep arm curl
125,بیشترین اختلاف پرسپولیس استقلال نگاه بالا
126,مشاهدة مباراة برشلونة واسبانيول مباشر بتاريخ 2018 laliga live
127,umpir call lunch india need two run victori twitter astonish
128,canadian basebal leagu went wrong
129,newcastl unit brand shambl terribl transfer window remov
130,cricket comment outrag umpir enforc lunch break run requir bat team victori caus delay minut match end serious save time prioriti cricket rule rule remov british imagin someon strike larg gong team bell hop run onto field trolley full tea pretti hilari think british peopl play cricket fair mani major cricket nation british coloni fair mani sport play world wide invent british
131,تبریزی محبوب استقلال پرسپولیس مبارز کوچک
132,bruin fan sing nation anthem boston marathon bomb wow impact merica gave chill watch live exactli need see day boston ghost town bomb close martial law could final found piec shit hide boat end craziest week life downvot dude realli
133,prediksi omaha senin februari 2018
134,yuzvendra chahal kuldeep yadav turn ball surfac say virat kohli
135,watch live eagl patriot lii super bowl onlin live stream
136,super bowl citi build ring
137,workout
138,enough time prepar 3rd odi say aiden markram
139,footbal san marino money glori dream retir san marino live year long enough citizenship join san marino nation squad play coach world cup qualifi still work toward
140,60m meet lee valley got new
141,টবল গরণ পরবর
142,dad want quit greg chappel pick sourav ganguli
