,text
0,colleg footbal pump remov
1,sinc much hate ceo right make love upvot appreci founder amaz app funni mad use creation also yay sport remov ask upvot directli reddit rule http www reddit com rule post remov feel free post without ask upvot bot action perform automat pleas contact moder subreddit messag compos sport question concern
2,footbal man citi bear titl premier leagu return
3,spain real madrid identifi three altern lewandowski remov
4,prediksi bremen frankfurt
5,prediksi legan valencia april 2018 pertarungan sengit
6,england new zealand
7,year old account play emerg goali chicago blackhawk made save incred night guy love face make right clock ran like yeah noth special get play give coupl minut could probabl learn skate small activ roster backup goali line time jump crazi night madhous madison http www youtub com watch fde7ozbxsbw 0h1m54 channel name tom leonard video popular 100 video length jump sec earlier context http www youtub com watch fde7ozbxsbw 0h1m49 downvot delet malform comment sourc code http github com ankitgyawali reddit timestamp bot suggest http www reddit com timestamp_bot activ goali one got injur game one 3rd period freak circumst believ 1st 2nd stream hurt 3rd stringer cramp second period put ussual ton back goali like rare ever totem pole much think someth like happen huge soccer game one line judg got hurt someon crowd got pitch help ref game grant prior experi
8,pacer nail upset competitor slam ball proce make bogdan known good shoot surpris thought far away shot cool check
9,legend zelda ouija board made lokai remov
10,prediksi eibar sociedad
11,watch live anthoni joshua joseph parker saturday march 2018 livestreamzon com
12,report arsen liverpool join race sign milan target remov
13,wwe raw result john cena taunt undertak reaction highlight march
14,seri unfortun event back
15,lái điện đụng đua điện đụng nhau vui nhộn
16,manchest unit jess lingard want emul class remov
17,shop best mountain bike bicycl part singapor mtb trail demand
18,pokemon time plush pokemon center remov
19,happi open day smoke weed everyday
20,say goodby player toughest thing darren lehmann
21,visit page
22,stanton provid tantal preview possibl realli torn excit watch yanke team smash basebal
23,sachin tendulkar ball tamper give space
24,antetokounmpo score buck rout warrior
25,instagram ben arfa bid farewel psg remov
26,turn facebook track happen
27,profession shoot young talent sport interview ace shooter abhinav bindra
28,footbal train academi bristol toddler
29,wood burn pikachu charm made maddisoncheri remov
30,help yemen children footbal fight world cup yemeni children fight live everi minut yemeni child die fight think unequ competit
31,prediksi skor eibar real sociedad april 2018
32,main tembak ikan timezon
33,spain barcelona line bid sevilla leipzig defend remov
34,sport think luck play part whatsoev remov
35,scott foster account day beer leagu goali side ask backup chicago blackhawk case third string goali injur delet seen post game interview fantast full version http www youtub com watch rb60iasuiu0 wear pad everi game see chanc need think sport possibl must watch great front audienc
36,sau thời gian chúng huyền thanh khoe bụng bầu tiết giới tính thai nhi
37,pari saint germain rule neymar return april sourc remov
38,want know stand get call european footbal tryout
39,prepar dream golf career
40,outrag sexual assault theae day kobe bryant get pass remov
41,retrogamingblog mario kart remov
42,cảnh hôn nhau lãng mạn phim truyền hình trung quốc 你从来没离开
43,درآمد باشگاه حضور بازیکنان شان جام جهانی چند میلیارد منتظر سرخابی
44,dart daryl gurney win belfast homecom
45,juventu milan countdown cutron buffon score goal remov
46,beat chelsea matter poch remov
47,karlsruh valencia 1993
48,pakistan super leagu 2018
49,david benavidez ronald gavril highlight 2018 wbc world super middleweight titl
50,galaxi pay amount acquir european soccer player soccer huge sport david beckham nearli 100 million usd zlatan ibrahimov none peak acquir still massiv amount money thought soccer big busi buy expens european player realli know afford past think misinform much money galaxi pay much money fact pay anyth went free transfer wage around per year absolut massiv ibra well went free transfer plu taken percent pay cut join think say lot much money realli american club realli big name player even well past peak nobodi good would want come america peak still came free transfer give consider money work usual would pay lot player much think make lot money endors etc america club afford even afford well peopl like beckham attract attent within america mayb even within part europ endors increas ticket sale etc increas revenu love ask question peopl gave answer respond everyon explan stupid respons ask question first place delet game lot wealthi owner might make much differ bet peopl sweden bit interest ml thing happen beckham move end weekli highlight show galaxi shirt sold high street sport shop soccer may huge america europ million buy shirt big club includ galaxi take exampl british club help understand money much issu paul pogba bought manchest unit 125 million firstli bare mind multi billion dollar investor secondli see club revenu come merchandis sale ticket sale trophi win etc manchest unit gener 125 million back within first month pogba shirt sale alon add million make week ticket sale see quickli money come back peopl rich make money peopl outsid american dip kind market averag american know beckham ibrahimov averag sport fan gener know realli stupid respons think allow ask valid follow question except zlatan fun want money back case think cours market american soccer outsid club typic earn money shirt sale sell right beforehand plu think mani european buy galaxi shirt cool thank answer bet someon get money back busi model say galaxi would imagin would would ask american realli certainli consider would know galaxi player beckham sure american sport fan averag american know beckham ibrahimov averag american dude pay attent sport probabl huge market pretti much last market top level soccer player penetr point averag sport fan even averag person everywher els around world know beckham ibra might well come cash littl dick around field awhil go say averag sport fan know name lot player team differ sport know hockey player team follow game know beckham never heard guy heard high profil soccer player put money get bigger return tottenham fan everyon els differ stream revenu like ticket merchandis advertis endores etc arsen fan fuck anyth cool got impress tini sport must underestim popular spur fan freedom speech soccer notic everi year fan feel becom popular demograph countri chang tini exist scale entir usa even mean still tottenham fan geniu
51,nuevo video fcbutelevis youtub
52,javeriya aspir footbal
53,prediksi skor malaga villarr april 2018 ambisi tim tamu
54,drama goal liverpool crystal palac
55,nainggolan hope juventu win scudetto remov
56,gym equip india
57,time easter basebal team
58,golf manag degre bachelor scienc
59,premier leagu run man citi close titl top four still balanc remov
60,بیرانوند آقای کلین شیت
61,cara isi kredit tembak ikan
62,special price chelsea tottenham win remov
63,intern soccer star zlatan ibrahimov arriv first meet galaxi fan delet move america find teammat beaten yet
64,đoán arsen stoke citi 19h30 ngài 2018
65,report inter line marlo sabitz bid remov
66,ipl bet tip ipl 2018 bet tip ipl bet tip today match remov
67,shoe stuburt urban grip spikeless titanium
68,chelsea boost transfer target involv dress room bust jose mourinho remov
69,hasil skor akhir pertandingan liga europa april 2018
70,đoán chelsea tottenham 22h ngài 2018
71,year ago use dream aeshet bodi attract women think happen hard work pay guy keep grind follow dream
72,everton man citi bet odd citizen remov
73,hasil skor akhir pertandingan liga champion april 2018
74,weird sport around world ocho where cotton
75,aussi cat
76,sorri emot steve smith break apolog cheat
77,shaquem griffin entir nation behind rugbi tag shaquem griffin respect realli hope long career leagu sec fan might still butthurt support happen
78,arnold shwarzenegg greatest bodi builder highest paid actor favourit actor shwarzenegg remov
79,stephen llega final miami detien nuevament azarenka remov
80,prediksi skor atletico madrid deportivo coruna april 2018
81,spring train
82,annual good friday rugbi match helen wigan today biff match year ago mark wahlberg
83,加圧ビューティーテラスは危険 2018年最新版
84,adelaid unit cruis past wellington phoenix win close secur final spot remov
85,surf wetsuit men women kid wetsuit manufactur
86,electr sport event ever attend live remov
87,blind pass weekli featur ghana premier leagu five thing learn week remov
88,barcelona star player lionel messi purchas 26m luxuri hotel ibiza
89,كأس الملك وموعد مباراة الفيصلي والأهلي وما القنوات الناقلة لها
90,top privat school bring power elit power forward
91,top extrem danger adventur sport around world leav awestruck
92,bayern munich surpris alvaro morata link remov
93,celeb shed tear repent indign delet
94,nelson cruz destroy basebal explos look made contact chaulk pitcher rub ball kinda like destroy world seri forget play right field frick guy fake 412ft homerun marin superimpos spark video http twitter com marin statu 979557515657494528 boomstick gifsthatendtoosoon juic ball powder ball hell mouth guard omen slow pleas believ ball still fragment day one slow bang damn griffey swing spark make contact http imgur com ijqxbmd need video ball look like home run action essenti possibl juic appl juic shot bare made wall news water wet get one adult pacifi one thing sinc small child gotta love steroid crush favorit person stori basebal drunk guy sit petco play marin wear rod shirsey heckl nelson cruz sort thing includ ped around 6th inning line hey nelson cost texa world seri come drunk mouth could tell cruz heard react littl rosin effect yep rub littl bit dirt game ball use chaulk brain stroke point never made end comment ball desentigr guess effect someon ad video fli ball still haunt fuck man still rememb exactli also year feliz struck put rod goddamn still hurt play ruin sport forev feliz never forgiv gosh dang butthol anywher without 2010 2011 pop open day yesterday wife ask flag differ color flag also new hat drew lot flak work today nice hat look littl heavi though cmonnnn honestli though still hate day hurt bad woman die hard cardin talk still salti umpir seri umpir loui like come fuck even make differ piss hate poke old wound thank lifelong cardin fan oriol good eye explos also track camera movement homer fill haha watch giancarlo stanton get hit face understand edit link http youtu sbqpk9bva14 piec goe side helmet protect jaw cricket die 2014 take ball wrong http www youtub com watch 7snlgtdnajm helmet enough need move protect aswel ball liter destroy residu homer center probabl 405 feet think pitcher use excess amount rosin came believ 420 foot bomb pacifi part helmet protect jaw face play petco yell loud heard petco hoisin ricin vote even though right liter job basebal guy spit ball game rub basebal rub mud sound ridicul true guy spat rub mud everi singl basebal use marin home game year http mynorthwest com 12676 spit mud make special sauc everi marin basebal imagin mani peopl touch spit yup yep game everyon chant roid game 2011 goosebump think 100 alway hurt even win one wit strike two out twice bit loop feliz look littl heavi miss lol game excit hour life fuck david frees awww even wors fuck man 8th grade play first base throw third baseman short hit rock anyon play know ball hit rock shit goe sideway took hop straight eye swell shut black eye within two minut imagin mph ball would feel jesu gosh cgi bomb http www mlb com marin video cruz two run jack 1899051183 tid 16285926 play petco 2015 season interleagu play although move wedsday afternoon could vagu hear level wesley willi song cheetah stuck head thank sriracha sauc hoisiiiiiiin szechuan boysen berri roisin http www youtub com watch qzo4rzxf3x4 sosin niacin well threw pitch realli know good pitch cruz miss catch blame tri think anymor like texa fan burden best game ever watch best seri ever come love ranger seri perfect oriol said man closer mph still farther human popul could hit sauc moisten riboflavin well cub fan posit live like neither thing purpos unlik steve fuck bartman fuck would rob outfield easi playoff would never mind sorri anyway player make mistak bet hate million time wors everyon stadium blew catch made catch like win world seri gotta let dude usernam check dajesusbot bodi fuck jesu nsfw lyric http youtu gql llphnfe yeah sure realli hard cruz feliz player retir speech micheal young said absolut haunt wors think catch would actual two out two strike 9th frees hit ball right horribl sport moment franchis fan actual go tri get back basebal year take son game year think easier sinc ranger expect suck made catch like win world seri gotta let dude confus texa cruz made catch out bottom 9th texa win lead caught ball instant indisput win yeah saw watch play damn one catch would chang life forev sadli miss catch thing reason thought one
95,scott foster last night beer leagu player keep play crowd love awar emerg goali thing nhl pretti cool step father would proud see everi middl age man dream hell would lose mind got call like must surreal experi hope movi proper depict think come team point clinch game playoff foster save day season would cool
96,sidney crosbi slap rebound midair win game man fun watch hockey equival self alley oop delet rush
97,marcella torr fit lifestyl glute exercis leg exercis brazil
98,last year final four south southern time held outsid south southern team time super small sampl size one two game would close gap south never effect defend territori 800 588 2300 empir today year southern team mix bet kansa caus duke unc florida kentucki southern school word southern school gener better basketbal duke championship guarante delet southern school hand extrem good incest roll tide motherfuck
99,basebal documentari netflix delet blog allow bot action perform automat pleas contact moder subreddit messag compos sport question concern
100,mickelson still push grand slam glori remov
101,wow spongebob play lot sport
102,manchest citi team news citizen play everton remov
103,midtabl premier leagu team perform wors end season
