,text
267,golden state warrior defeat cleveland cavali 129 120 becom 2017 nba champion
268,cleveland offici blown deficit remov
269,golden state warrior win nba playoff final score 129 120 remov fuck game stephen smith curs broken sport suck
270,great game great team great player great pub santa barbara check left guy
271,guess blow lead delet
272,golden state warrior defeat clevland cavali 120 129 game delet kevin durant mom proud
273,gsw win nba titl final score 120 129 delet
274,least whomev run game bootleg stream sens humor
275,golden state win final 129 120 delet
276,durant mom post game proud son fuck yank napte man report need gtfo let moment racist legit know dad aliv sick anyth ask sound racist father show game rig son took join win team three star reign mvp fair report reason make much money father walk mom babi reconnect later life also super super close mom tell racist saw live saltier pacif ocean comment cannot ignor get downvot victori taint thank see racist good get one turn around earth make also good job question quit assum salti proven heat inde buy champonship mvp nba that truth although still doesnt mean durant asterisk next name salti dub better team durant play ass shit without cav probabl take seri make said less true sorri realli make ass shit basebal proven
277,golden state warrior win 2017 nba championship delet
278,hate cav defens see far defend point paint bound happen defend half court
279,debat lol reddit trigger commerci lol nba woulda thing readi lebron lebron comparis jordan lol may well renam nba react durant decis casual nba fan happi kevin durant right hater alway hate like lebron alway happi see star get shot ring come great stay loyal team okc ditch entir fan base seattl problem commerci almost impli overcam neg prove everyon wrong nobodi surpris golden state pretti much everyon expect sinc last summer seem like lot peopl hate david stern allow glare lack pariti leagu never would allow top player team alreadi reg season win hater win championship two team final three year run good sport ask half time game adam silver answer beat around bush act like good thing nba rig laker gotten cp3 allow durant warrior lmao see top youtub comment though nike fast shit chamber person opinion commerci show critic shut anyth got louder agre nearli everi comment see say fuck call coward selfish self righteou fan way look truth owe fan anyth nba win right thing best chanc win championship golden state right build best team possibl say ruin nba must miss year team domin leagu year year fair play mind final outperform mani thought would could way help lebron think clear seri toss without impress perform even though heavi favorit laker fan cp3 situat trade deal nba right hornet back decid block deal basketbal reason fuck dan gilbert david stern kevin durant free agent free agent player team choos long team pay contract nba block dat salt peopl forget move could huge also free agent allow ever would like wherea cp3 situat trade albeit stupid let nba author free agent goe anyth got louder saltier yup funni thing lebron win one land jame lock come back cav next year pursuit championship clipper rumor believ demonstr loyalti anyon except famili case mistaken lebron one year deal turn sign multi year deal last offseason http www espn com nba stori 17287762 lebron jame sign cleveland cavali new multiyear contract overal point still stand though everi player leagu truth everi player leagu look coach noth wrong thank say keep hear shit cute salt everywher http www youtub com watch 3kqufzyi6l0 lebron actual contract next year thought sign anoth year contract inde right stand correct http www espn com nba stori 17287762 lebron jame sign cleveland cavali new multiyear contract
280,champ warrior finish cav game win nba titl delet
281,rate favourit cricket mumbai indian
282,year sport win franchis remov
283,jordan sale new aj12 aj31 oregon shoe remov
284,favorit shot kevin love game
285,respect delet
286,durant help golden state warrior complet reveng tour 2017 championship lebron cav delet best could make origin http www com nba 2017 nba final score warrior cavali championship kevin durant stephen curri reduc bot durant vindic much malign decis join warrior last summer take control team final unquestion lead golden state resound seri win cleveland durant may join one greatest team time last summer 039 hard imagin golden state win seri without floor slow team 039 question haunt nba team summer long like everi summer forese futur extend summari http reddit com autotldr comment 6gxmvx kevin_durant_helps_the_golden_state_warrior faq http reddit com autotldr comment 31b9fm faq_autotldr_bot version 142743 dr far feedback http reddit com messag compos 23autotldr comment monitor construct feedback welcom top keyword team durant seri golden summer durant vindic much malign decis join warrior last summer win vindic decis critic peopl think could win titl team game
287,salti okc fan right durant win championship final mvp remov okc thank westbrook selfish player leagu
288,chri rock heckl cavali richard jefferson nba final delet think figur paid 133k floor seat watch without rememb video chri rock tri talk kobe ignor hahaha chri hilari man obvious play around still heck funni aaron rodger snoop diddi could anyon
289,anyon els glad wont forc fed humbl kendrick lamar everi commerci break remov
290,adam silver remov
291,tabl turn delet
292,discount ranger ticket
293,ماذا رياضة الجمباز delet blog allow bot action perform automat pleas contact moder subreddit messag compos sport question concern
294,kevin durant warrior beat cavali game win 2017 nba championship delet
295,nba final golden state warrior win titl cavali gone viral
296,let excus begin delet golden state stack durant definit fought hard earn ring better team overal well deserv stay okc improv team would earn congrat tho
297,مكالمة هاتفية رونالدو إلى ميلان رسميا ريال مدريد يستعيد مهاجمه
298,cheap texa ranger ticket
299,kevin durant win nba final mvp
300,team keep lose remov keep pick everyon finish regular season first place eventu win championship good job alreadi
301,peculiar nine element ratio display
302,lebron jame felt like lose 2017 nba final delet think fair question alway wonder top profession athlet realli feel lose championship wonder natur realli competit devast loss put perspect know realli matter feel like guy like lebron matter lose seri cost singl endors singl penni lose respect player coach owner still best leagu thing lose bunch sportscast loser internet say omg goat four rii probabl live without say want honest answer either godammit wanna win matter suck look next year whatev still lebron jame hate watch bore sport interview clich answer best gotta give team credit blah blah blah blame kevin love move suggest warrior best team last year well perhap meant three year span weird posit put seem increasingli sick media shit late sure face seemingli unbeat oppon lose aid wow love compar write best column life one pick instead complet made understand report ask question heard type question ask hundr time never heard take time leader lol good guy meh lebron crybabi last wear costum halloween mock warrior lose cri yeah call team stupid never legend jordan even decad call quit jordan jersey shoe still hot item wait legendari best team last year choke took meant regular season record holder kind dick question tbh lebron jersey hot item year retir shoe right time right place nike machin whoever leagu best player 90 would airman happen jordan leader throw anyon bu clearli wide describ best player game emot reaction lose sport championship margin go offer ask job get tape ask guy ask say sound silli ask job creat interest answer though tip toe around someon emot sure jersey even sell jersey play best right retir sure lebron good abl give cav anoth championship cleveland alway cleveland anyon wanna bet lebron leav contract gonna goe better citi better player
303,championship mean better lebron ring count playoff win respect never carri franchis ring gsw question alreadi one recent absolut lebron better number seri right averag tripl doubl sure stuck deni great whatsoev context think close ye close lebron better seri talk right never debat better time player better right today well that opinion that ask question curiou know peopl feel think lebron great seri howev think kd skill set unmatch right nba draft right current player includ would pick first build around
304,cara mendaftar permainan ion casino menggunakan jasa agen
305,jasprit bumrah biographi height weight age wife affair
306,بازتاب صعود ایران جام جهانی رسانه های معتبر دنیا
307,new york met chicago cub mlb pick odd predict sport chat place
308,photograph reflex
309,top tip win sport bet remov
310,как убрать живот почему растет
311,join youth basketbal team loui lhba remov
312,kevin durant talk first championship prove hater wrong delet
313,get togeth bruh
314,daftar tembak ikan deposit terjangkau
315,busi nhl schedul next week vega expans draft season forget june 21st also reveal jersey tweak next year edit may chang 20th fyi
316,guess watch basebal delet basketbal dead sinc sonic left
317,glimmer gear led vest men
318,feel like champion golden state warrior jersey set avail gone get http 5ksriz232 http 7qtpcdeney
319,rejuven queensland maroon beat nsw
320,kevin durant stephen curri lead warrior nba titl
321,prediksi bola persija sriwijaya juni 2017
322,order bowl trophi event care
323,jitu hina pair clinch shock gold defeat russia issf world cup delet blog allow bot action perform automat pleas contact moder subreddit messag compos sport question concern
324,steph curri celebr championship famili podium
325,جهانبخش بهترین صعود تاریخ تیم ملی جام جهانی رقم زدیم
326,western rig holster leather smartphon case
327,lion play highland look sustain momentum first test delet
328,prediksi bola mitra kukar gresik unit juni 2017
329,buy custom footbal uniform sport team
330,law enforc holster cowboy western leather gun holster blog allow bot action perform automat pleas contact moder subreddit messag compos sport question concern
331,pakistan win moment sri lanka rashid latif saqlain mushaq
332,مشاهدة مباراة الإمارات وتايلاند اليوم الثلاثاء 2017
333,jame spectacular effort enough cav anyon els click cuz pic realiz sport realiz prolli guy
334,leather belt onlin leather accessori store
335,new hindi song
336,hmmm
337,pool work play final game bottom left delet never understood work pretti sure got screw money need squar land last digit team final score laid chart buy squar buy better chanc could also lose though call gambl guess
338,freo ruckman resign goal
339,peculiar nine element ratio display
340,nhận định bóng việt nam jordan lúc 19h ngài
341,buy cricket bat onlin tenni equip
342,2017 warrior cavali nba final montag
343,wholesal brand unisex arena low top light comfort women men outwear fashion casual shoe
344,vinc hizon excit new role blackwat
345,lion tour 2017 preview lion highland 1014 episod
346,dubsofglori
347,تاریخ نشان دهد سخت گیری روش انتخاب مسافران جام جهانی
348,lebron jame latest pic nba winner 2017
349,ridicul catch jeremi howe afl australian footbal leagu delet
350,great britain olymp bobsleigh coach accus racism athlet
351,physic therapi la cruce massag therapi paso texa
352,free couch revolut train program remov
353,scotti thompson take selfi liza soberano
354,root sport becom amp sportsnet juli
355,nfl network tell talent stick sport social media
356,andrew mccutchen fail leap catcher made incred sport photo
357,new england patriot brandin cook tom bradi offens sport final wbz
358,kevin love uncl beach boy uncl worst beach boy matter fact least relat brian
359,could sport bet next nfl season christi say
360,congrat jimmi alapag moreno expect babi boy
361,situ pasang taruhan bola dan casino onlin terpercaya
362,sean pual new song
363,pardon take took sport podcast
364,predat fan say nbc sport rep offer hat exchang mike milburi sign
365,bike balanc
366,ibf confirm judg error ryan burnett victori lee haskin box news
367,sport media white win emmi way fsd
368,british cano confirm new investig abus alleg
369,warrior slay cavali reclaim nba titl cbc sport basketbal
370,شجاعی پیش سوی تاریخ سازی حضور جام جهانی
371,pkl 2017 puneri paltan full team squad final player list
372,bike jumper parkour runner
373,juve dekati angel maria jika gagal dapatkan dougla evonikcash
374,inspir concepcion move new home
375,مسعود شجاعی فرصت بزرگ تاریخ سازی
376,golden state warrior cleveland cavali final score board archiv
377,sall sport annemass
378,giordana cycl apparel onlin cycl cloth brand
379,nba final mvp kevin durant get car celebr fan
380,synthesi beauti phase score think best score phase
381,bind truth ride futur fin am2 fin set
382,highland british irish lion rugbi 2017 live stream lion tour gmt 13th june
383,danh sách cầu thủ new zealand tham confeder cup 2017
384,donald trump sign patriot helmet
385,highlight pakistan beat sri lanka
386,ramo merasakan pale kehilangan morata agen casino terpercaya indonesia
387,túi lông trong suốt giá tại nội thái hưng 0975155547
388,golden state warrior champion
389,danh sách chuyển nhượng cầu thủ bóng châu mùa 2017
390,dynasti sport frame
391,best stori 2017 nba final cavali paid golden state coach beat remov
392,desi sport episod mallakhamb pole gymnast
393,live score footbal app listen favorit sport live new comment pundit sport next proud fan live score footbal app
394,mlb cincinnati red infield pop avid red fan confirm liter season nutshel shortstop prioriti rest infield play like infield recogn right shortstop take shortstop make sure everyon els know take ball trust get way love see play like mlb make realiz matter good guy still human be play game welcom cincinnati sport finest alway run love fault sinc short stop ball go right stand jog away everyon els look dumb rather follow basebal tell lose third inning still video sourc http mediadownload mlb com mlbam mp4 2017 1492515583 1497324007382 asset_2500k mp4 appreci shortstop realli respons blunder head enough head 2nd case runner went easi retract embarrass self defeat shell someth like happen choreograph perfectli first saw thought video game wonder happen hint link legitimatepresentflyingsquirrel wonder score got even think happen littl leagu game cue benni hill theme yup red one mani reason lose good job everybodi time beer springfield isotop colouris 1992 padz boy get paid million dollar cant call one anoth ball til bronson arroyo still play remeb basebal player use call fuck ball see singl guy talk everyon cool use basic ass fundament teach let talk leg kick windup though get ball make feel better upcom seri red delet padr fan glad hit particular scenario surpris see role revers think season gone bad mean rebuild glimmer awesom shimmer everi ye sir manag hate bronson arroyo bottom 3rd alreadi given run still game real red fan guy doesnt know talk appear fielder say anyth agre weird one pull first shortstop lose swagger play would call peopl ball right face god damnit shortstop sure expect sprint short fli ball hit foul territori get fat ass quick enough pivot chase jog nab one half distanc ahhh see someon play pop prioriti practic pitcher he point closest gredg maddux would made catch still hear littl leagu coach say thing third first busi even area would say human queue song show happen lose sun track whatev call look like say someth sure alway best keep quiet situat unless call infield fli rule appli runner base edit question get error situat player could make play shortstop get one suppos take charg tough offici scorer someon base forc run like man 1st man 1st 2nd sinc one base batter safe look like anyon base think one million dollar thank play bit stretch point career rule learn littl leagu right keep eye ball bronson arroyo normal windup clearli know noth basebal shortstop prioriti everyth infield call whether captain team saw score stuff thought red hit first lol joey votto glimmer ahhhh real fan look get half bad year howev look comment wrong way group guy chanc make great play small error commun mess stori lot game coupl error bad inning two pitch otherwis solid season especi given fact last year live hope came bullpen end red yep year get stuff like play ball start teach around age guess know one first strategi type thing ever learn basebal common practic everi singl year play eleven year worth practic guy major sure known much longer still happen sometim lol upper leagu day pitcher rare ever take ball someon els get especi like pitcher look air tri move ball mound could easili turn ankl trip twist knee etc lose pitcher take good team race hurri tri protect pitcher much possibl case shortstop yell lost sun someon els call get yeah lose ball back call anoth player take case lost call third baseman take error infield hit error non attempt brave fan fuck least 1st 2nd less impress still get leg glisten he got littl feet hurt true nocontext need ye word forc third base out infield fli catchabl whether catchabl left umpir forget much listen http www youtub com watch 6ujblknuc wild card playoff game catchabl routin effort infield basebal fan link appreci live atlanta known brave fan sound right
395,cheap yeezi 350 yeezi 350 nmd wholesal air max 2017 air jordan air forc onlin outlet store delet
396,مرتضی تبریزی ذوب آهن تمدید کرد
397,enjoy fantasi sport game onlin india golden jeeto
398,tanzania footbal feder tff fixtur result news wincup com
399,brazil score australia second match video http www youtub com watch n4dgezoafi8
400,sachin refus walk nick ball free hit exhal
401,boot camp group person train
402,جوایز جدید یوفا برای تقدیر بهترین بازیکنان لیگ قهرمانان لیگ اروپا
403,tin chuyen nhuong cập nhật thị trường chuyển nhượng cầu thủ
404,made laugh knock great gonna end worst top best ever dude must delusion
405,perfect craft episod abhinav bindra olymp gold medalist
406,let domin continu movi bleacher report super team music video funni
407,cristiano ronaldo face tax fraud lawsuit use busi structur hide earn delet holi crap big money continu play spain
408,250 000 week much richest blog allow bot action perform automat pleas contact moder subreddit messag compos sport question concern
409,angola footbal feder faf result fixtur
410,one want make play delet quadrupl error group project like third baseman commit step away last moment everyon els thought would get blame
411,goldberg transform 2017 fit bodybuild motiv delet
412,electrifi event best sport announc
413,real madrid star cristiano ronaldo formal accus 13m tax fraud spanish author good old christi tri messi everyth larg sum money keep play spain mani soccer player europ get caught assum million pound edit opp pound euro like tax turbotax ton llc put money take money account probabl screw also tax rate spain stupid high also think spain countri govern come tax fraud littl evid like level oversight
414,اتهام فرار مالیاتی میلیون یورویی رونالدو
415,jame rodriguez chelsea latest transfer news 2017
416,riley curri stuntin reflect nba final trophi delet amaz
417,golden state warrior reclaim nba championship titl blog allow bot action perform automat pleas contact moder subreddit messag compos sport question concern
418,رسمی قرارداد گریزمن اتلتیکو مادرید تمدید
419,cristiano ronaldo accus tax evas think messi
420,warrior exercis demon realiti record set team ad 2nd best player earth pressur remov
421,backyard sport dedic share love sport within famili parent children friend neighborhood pleas review core valu see believ deliv partner client commun serv
422,prediksi peru jamaica juni 2017
423,pick best crossfit equip nitti gritti investig
424,enhanc basebal game bat cage new york citi
425,basebal player huddl togeth summon ball look like realli drop ball third baseman fault commit everyon els stay back step back last moment catcher obvious get meet memo anyon catch need watch cricket see properli catch ball sure cricket player must cat previou life thought someon els would catch
426,brian wilder year old june 21st gave herp 1409 john place apart track mainten mta cure herp keep women life away guy
427,bhutan maldiv today live stream result channel info sports24houronlin
428,australia brazil highlight jun 2017
429,footbal predict
430,look best basebal camp new york citi blog allow bot action perform automat pleas contact moder subreddit messag compos sport question concern
431,first time histori champion trophi year ayupp
432,اهداف مباراة البرازيل واستراليا مباراة ودية شاشة كاملة تعلي
