,text
534,fight night global несёт потери бой расула мирзаева против ержана ест
535,liverpool juve target exclud real madrid squad la palma remov
536,caleb ekuban score leed unit pip bolton wander remov
537,prediksi skor juventu real madrid april 2018
538,england shadoff hull content lindberg lead first major year remov
539,inter verona confirm line up live updat remov
540,super leagu helen wigan warrior
541,commonwealth game daili discuss thread remov
542,alan shearer love saw saturday afternoon jame park sofa time remov
543,windi tour pakistan 2018 long time year pak 2018
544,buffon allegri slam juventu fan milan win remov
545,paul merson predict jamaal lascel goe somewher play big team remov
546,histor goal
547,newcastl jet melbourn citi erni merrick side momentum stall ahead final remov
548,pernilla lindberg take shot lead ana inspir
549,مالک پاریسن ژرمن توخل عنوان سرمربی بعدی تیمش انتخاب کرده است
550,west brom burnley 100th win burnley boss remov
551,đoán getaf real beti ngài 2018
552,pogba must curb banter job man utd legend robson remov
553,pain bat despit fractur thumb
554,oklahoma nurs home employe addict sex forc feed elderli viagra fake news blog allow bot action perform automat pleas contact moder subreddit messag compos sport question concern
555,gilberto silva reveal lehmann influenc thierri henri goalscor arsen remov
556,condit critic hospit issu updat former chelsea manchest unit star ray wilkin cardiac arrest
557,shootout wrap daniel arzani mount compel case includ least extend world cup squad remov
558,six stadium longest biggest six cricket histori ever
559,nathan wheatley move
560,cara pasang taruhan judi bola onlin
561,zlatan zlatan major leagu soccer digitalampl com
562,man citi europ best squad manag guardiola bruyn prais club legend remov
563,joshua eager face parker heavyweight fight
564,tick tock
565,defens chang manchest unit afoot remov
566,hurl ronan maher score point sidelin ground metr goal disgustingli good sidelin cut irish know sound mushmouth gaa seriou bit skill anybodi abl translat lol great skill sport absolut filthi hurl thx never heard basic gaelic footbal stick smaller ball
567,mohammad amir three import wicket
568,team11 ali krieger sotw sydneyleroux remov
569,dean elgar take stun catch australia super catch deano bill lawri call actual happen led abl jog field like anyon take great catch get minut break cake end australian inning turn bat final wicket taken elgar open bat get chang room prepar put pad etc back pitch shortli 2001 one test match india domin australian team mainli due freak inning player name vv laxman sinc captain gut enforc follow ensur eat cake fifth day rather play meaningless cricket kid elgar ran back pavilion like explain sri lankan cricket team yup get eat fish puff though
570,hockey team honor la vega shoot victim banner retir number
571,амарок герой бездорожья volkswagen amarok 2017 тест драйв бездорожью
572,dinamo moscow midfield abdul aziz tetteh tast win russian premier leagu debut remov
573,meet glamor bodi build ident twin sister becom instagram sensat
574,prediksi genoa cagliari april 2018 manfaatkan peran tuan rumah
575,manchest unit martial bale remov
576,zlatan debut goal galaxi zlatan thing ever delet zlatan destroy whatev got darwin quintero come _start weep tear freez hit ground_ zlatan zlatan ever got bunch contend yard bike 4th england kick cassano head interview word full page ajax goal big player interview thierri plenti ye ml grandmoth could destroy retir leagu dead decad
577,لادروپ منتظر بازی ورزشگاه تماشاگر هستیم
578,world cup hope daniel arzani star melbourn citi newcastl jet remov
579,juventu hope man utd sign bale summer remov
580,pogba commit man unit problem mourinho remov
581,dynamo moscow zenit petersburg 2018 russia supe
582,cricket jame anderson bowl watl great deliveri delet much allow cover peg thing caus look like stand complet front stand wherev want stanc pro con depend type bowl batsman may choos cover leg stump right stick right hander shown video middl stump left cover stump may end play ball far outsid may result edg ball fielder behind may also lbw foot right front stump cover stump obvious thing like shown video might happen ball hit leg front stump leg wicket lbw unless hit ball first bit like foul get struck basebal ball special swung back toward batsman hit seem move away batsman bounc deceiv play wrong line
583,assassin gigi buffon explain admir cristiano ronaldo remov
584,team11 travel day sydneyleroux remov
585,floorbal walk
586,pak live stream first t20 match west indi tour pakistan 2018 sports24houronlin
587,land punch count rocki balboa ivan drago rocki aprilfool
588,neymar final speak possibl real madrid move remov
589,happi easter zeaster bunni thing unse
590,benatia juventu four point lead napoli mean noth remov
591,helen wigan super leagu head head rugbi leagu news
592,http sportsmerch godaddysit com buy softest afford merch game
593,chelsea tottenham hotspur team news kane start bench courtoi miss remov
594,first group heart cri colt remov
595,chelsea tottenham confirm line up live updat remov
596,lebron jame cristiano ronaldo remov lebron could great keeper see video ronaldo attempt throw american footbal think goe without say ronaldo much better feet hand definit go lebron one new akinfenwa messi say lebron one would imagin lebron could pull togeth least sub par soccer game find hard imagin ronaldo abl shoot jumper agre plu own minor share soccer team england would imagin might play around littl
597,kkr gautam gambhir raina highlight ipl vivo ipl 2018
598,two question regard emerg goali blackhawk play day mad player struggl minor year never play nhl guy say done team use one non goali situat like basebal team use field player pitch blow mad player struggl minor year never play nhl guy say done still play pro hockey scott foster still technic play pro hockey sinc ebug contract forbid compens bitter jealou sob might harbour resent foster would tell world differ guy like garrett spark team use one non goali situat like basebal team use field player pitch blow possibl field player hurt arm pitch goaltend ice hockey much specialis basebal player throw ball tri pitch goali wear complet differ equip top head blade skate receiv complet separ train equip look protect basic noth posterior surfac bodi except rel thin pad tailbon spine fall protect float backplat rear mask posit extrem danger play well level let alon actual know put anoth way scott foster dozen year specialis train colleg career continu take regular advanc lesson amateur still signific chanc could injur game far beyond level ever play way risk health regular skater roster said happen hockey past lester patrick retir player coach ranger famous went goal 1928 lorn chabot injur montreal maroon forbad ranger usual courtesi use anoth goali alex connel sign team top post good addit point team minor leagu goali town avail team keep emerg goali situat press box case fact play slight minor leagu goali talent question avail even gear second question part answer first player would need remov gear put goali gear come back guy could readi faster pad fit addit realli damn hard play goali know put anoth player good forfeit guy bit experi least adult beer leagu incent play goali avoid pay fee fact classifi amateur would mind invalid victori way wpg fan anyway great answer thank agre said sell chanc get injur play pro colleg level movement differ flexibl colleg pro goali realli exist argument might made pro shape play men elit beer leagu pro like sure team emerg goali hockey shape emerg goali tryout pretti extens made cut slouch would invalid win amateur golfer play master week even major consid greatest accomplish histori get money make win less valid
599,fabinho contact psg transfer remov
600,absolut class fantast newcastl fan react year old perform twitter remov
601,jab ball train indain guy
602,ipl 2018 chennai super king delhi daredevil highlight special move
603,excel run deep brien famili remov
604,milb copa diversión start month
605,yoga leg object trendi comfort free ship
606,ww2 android
607,arsen eye real madrid keeper cech replac remov
608,harlem globetrott high five got smirk thumb got guy genuin fun watch great kid nice done great anoth complet unnecessari use slow camer neat harlem globetrott one greatest thing ever smirk remind princ hhhhhhhhhhhhhiiiiiiiiiiiiiiiiiggggggggggghhhhhhhhhhhhhhhhffffffffiiiiiiiiiiiiiiiiiiiiiiiivvvvvvvvvvvvvvvvvvvvvvvvvvvvvvvvveeeeeeeeeeeeeeeeeeeeerr loop unwav eye contact though took watch know think see globetrott futurama haha great kid like go alreadi warudo delet day old repost well play time shift activ well consid bamboozl alway felt like gif would better kid psych globetrott damn fake slowmo skill amaz usual obviou shake flinch happen dude crazi smooth got haha speed realiz child move normal speed rememb guy went crazi adventur scoob gang crazi globetrott mademesmil sexi hire guy pre natur awesom train creepi tbh stanc smooth wow slow motion kid realli move incred speed like got super power mean slow five slowest could someon put slow motion savor moment legit thought slow haha repost upvot sec thought slo even facial express froze hahaha awesom guess low slow lol thought slo effect god damnit know jalen ramsey play basketbal steadi eye contact hilari everi time one blink flamboy high ever seen glad know one pretend slow motion know repost make happi everi time see never miss look stupid gonna lie thought actual slow motion kid flash cool job man wish could jump someon speed normal speed look back reassur guy found neo way littl kid point finger gold soon see kid hand start activ slow mode dude fuck profession smirk smile anim lol made smile thought subreddit someth good happen end thought go snap kid arm five hard explain friend saw flip channel show sport event notabl quot confus first watch know sport pretti well never heard gener either guy short play profession ball greatest one okay guy fuck around sorri super knowledg basket ball harlem globetrott still good team know futurama stuff rank moment ever major tournament glad slow think gone full forc would disloc kid shoulder slo good gotta wonder long practic lol crack seen time alreadi last month bend thumb like wtf thought go behind back rememb watch maryland one year slow threw loop swap basketbal volleybal instant replay magic rememb see decad ago harlem globe trotter get eject dat sissi look someon pleas fest forward guy probabl got kick team shot clock violaton fabul high five jesu need die repost everi day week watch slowli see repost least time past week comed geniu stop repost everywher even comment everi sub thought slow motion first 7th time seen post week thought go snap kid arm thought slow motion first lol quick flick hand thumb awesom like role model sort chees think whole thing pretti slick knew camera rollin adult seem great sourc adult nice sum smart cue bender take pictur say neat actual fast cam kid move superson speed frequent start bleed real world got saw kid move like holi shit nice math game legit game blous alway think fat ugli mother menac yeah thought like right see kid arm snap rail slow motion carri watch ive seen gif probabl twice day week get repost like crazi repost frequenc crazi late actual repost crosspost crosspost encourag smooth pre requisit appli actual test smooth smooth turn lie lot especi thing like tri globetrott pre requisit came say delet real team play show pretti much sort trick fun stuff never seen life yet one know guy name harlem globetrott credit repost get shit yeah hope wink end gave away delet taken kid love stormin parti like name niño wanna waaaaast myyyh time heheheheheheh bitch want pancak also alway think fat ugli mother first time see gif feel like seen differ time last three day relentless quest karma done bot well bot downvot peopl point nope becom anoth casualti socieehhhtteee mean hard imag stay enough promiscu mother front page subreddit right get crazi repost still cool tho well rip reddit next skynet need cloth bike unwav attent yep nope never faaaallllll innnnnn line tit pretend slow motion harlem globetrott high five gif public place becom anoth victim conformityyyy dear god back
609,panama 2018 world cup usa delet
610,shohei ohtani make histor pitch debut today pacif year old japanes phenom becom first major leagu player start non pitcher open day start pitcher within team first game sinc babe ruth red sox 1919 delet delet delet lol
611,feder decid end career pasta aficionado truth imagin much longer left yeah peopl said 2008 2011 2013 2014 2015 2016 look
612,khedira whistl juventu fan remov
613,perfect within reach
614,constitut crisi cue sport world umbrella bodi refus recognis new world snooker feder
615,becom profession soccer player 2018 motiv video
616,aubameyang set new arsen goalscor feat stoke doubl remov
617,cardiff blue score tri ball bounc edinburgh player head delet
618,sail barcelona world race abandon catalan uncertainti
619,waldo join googl map april fool day
620,top best app watch live free android devic 2018
621,christian eriksen tottenham hotspur sensat goal chelsea
622,back remov
623,ceo need know digit advertis
624,profession athlet sport would hard time beat athlet 1960 older nba star team today would like destroy team would pool player today easili beat one back day probabl sport everyth better today better train athlet use improv train techniqu better facil thing like analyt nutrit train get train scout also improv player bigger stronger ever high school today better facil pro team javelin chang origin javelin contest could throw far would hit run track also altern throw method use illeg assum give old equip though physic sport know sport like pool athletic today way much team 60 overcom associ footbal rule back kick park sport would win requir physic abil hockey mayb rule chang much look play game direct competit though hockey use lot grabbi could lot without incur penalti modern nhl play old rule older team would advantag physic speak new rule could take nhl team 4th liner look like god compar 1960 team box heavyweight 60 would domin today bob beamon help would enjoy half time cigarett hate burst bubbl technic abil player today much ahead player back get anywher near realli think fighter period would make past second round like joshua klitchco ali forman frazier norton forman titl retir lose anoth titl bout good ali beat
625,arsen milan liverpool young german midfield remov
626,nesn sport
627,play cricket sun cool take photo let guess top pictur dust bottom dawn cricket think move feet one day dust sun rise side set though sure dusk dawn would possibl
628,laneig layer cover cushion
629,chase daniel valuabl arm footbal histori happi april fool 2018 big fan chase thought would funni video make finess gawd number may correct exact total made regardless made 10x peyton man made per throw basi also poke fun littl bit make play breakdown season often play call extrem long wind explan done playcal draw probabl one word day instal first day practic play get put super simpl actual pass play saw chase run total liter basic play anyon could run space crawfish bubbl streak hope enjoy
630,lightn larri luciano light torch great snail race one old great wonder never retir shell
631,pierr emerick aubameyang bag brace arsen beat stoke citi remov
632,lebron jame justin timberlak take shot stage
633,nice skill even know work wtf trump daca deal http www viral com 2018 trump daca deal html revers origin still impress http imgur com eslzosf jpg ahhh gotcha
634,video chelsea conced christan eriksen thunderbolt spur draw level blue stamford bridg remov
635,scott foster year old account play minut goali blackhawk save seven shot target delet day late alreadi post mani time
636,почему специи полезны
637,spain barcelona line summer bid psg ace remov
638,alexand zverev john isner tenni live stream miami open men final april 2018 stadium court
639,player float
640,barcelona kiss goodby 100 point leagu remov
641,asian footbal premier leagu kashif siddiqi problem still lie might take rooney rule fix
642,guess footbal shirt number footbal quiz
643,rob gronkowski retir seven season
644,sachin tendulkar donat entir salari prime minist relief fund
645,tottenham hero alli sure still criticis remov
646,prediksi atalanta sampdoria april 2018
647,cont claim anoth unwant record five thing learn chelsea spur remov
648,anthoni davi fool shave unibrow king april fool
649,ncaa nation championship 2018 live stream men basketbal channel
650,ufc 223 ferguson nurmagomedov прямая трансляция
651,jason kidd steve nash ray allen grant hill hall fame
652,loyola chicago michigan wolverin advanc nation championship watch video onlin video search engin delet
653,ملخص مباراة تشلسي وتوتنهام تعليق عربي شاشة كاملة 2018
654,arsen boss arsen wenger unhappi poor first half stoke remov
655,aubameyang sportsmanship make arsen stronger wenger remov
656,prediksi getaf real beti april 2018
657,see french footbal
658,mesut ozil get back stoke polic twitter account miss person dig remov
659,deadpool color book challeng
660,curiou anyon know lack sport free affect overal franchis follow sport much enjoy game notic last year cord cutter overal exposur seem go way still antenna get broadcast channel even watch much amount sport event besid occasion golf game saturday footbal sunday afternoon seem nonexist grow seem would alway sport event whether basebal game afternoon hockey basketbal game night never specif sought sometim sit watch trend continu least year ago cabl packag cours get creativ find way watch game realli want seek nld nlc game past season gener exposur gone make wonder kid grow netflix exposur team whatsoev meet dedic sport fan follow team entir live grew loyalti team almost second natur cost abl follow team high day team requir pay anoth fee cabl channel seem lot potenti younger fan zero exposur bode franchis futur hit stream subreddit american live abroad choic mani occas nfl game except thursday game network free nfl isnt lose viewer lack access speak sport watch european footbal nba watch sport honestli outsid two standpoint busi boom look size two subreddit social media standpoint seem let assum peopl live tweet epl nba access game everyth read nba rate seem soar despit best game turner local rate http www stlamerican com sport sports_columnist sports_ey nba rate soar nascar daytona viewership article_e8051a88 1ceb 11e8 a8c5 0b400f651cca html way watch sport without tradit pay provid includ sling psvue tube hulu cabl sport fanat take get ota antenna mlbtv free game day etc choos follow team get readi pay cute piraci option like kodi share pay password sport blackout ridicul mani way get sport choos follow either pay pirat simpl fellow american live abroad technolog great rememb studi abroad back abl watch acl nlc reason world seri mnf espn stream option whatsoev btw latin america espn nfl redzon standard cabl packag everi sunday put redzon big screen stream favorit nfl squadron keep date fantasi stat phone wife fuck hate monday night footbal espn day simulcast abc yeah get wonder instanc like kid could come home school see dodger game everi day kid adult will pay dodger channel mlbtv kid grow today might big dodger fan less opportun expos less like pay adult nation broadcast espn howev local market game simulcast ota channel know sure watch monday night packer game usual local channel nation sure team sport follow larg dedic dodger fan time chang peopl want watch sit hour sport event time tight peopl picki watch favorit sport rivalri playoff gener sport attend except citi like new york wonder florida even team sad fan follow good point grew live major market everyon becam bandwaggon fan final playoff bowl season
661,bruin abl tie game flyer insan scrambl last second horrend puck clear den terribl play simmond day clear puck god dammit team alway find way hate boston leaf fan understand bias opinion listen radio agon thank luck
662,need help charg record game offer process pull clip sourc footag remov
663,bilardo messi need win world cup pele maradona level remov
664,boston marcu walden catch comeback delet
665,super leagu widn vike helen
666,boban marjanov danc drake god plan easter
667,discuss plan six nation rugbi expans releg think hard believ south africa would leav rugbi champion join nation would mean team leav super rugbi also think japan would join rugbi championship good enough alreadi connect super rugbi see join nation see georgia possibl romania russia join nation promot releg system make last place team playoff winner comp promot fair one home nation crap enough come 6th lose georgia tradit sit year broke fix honestli europ make much sens south african team timezon wise might argu broken itali one game year say georgia would fare better deserv shot ye true simpl south africa leav rugbi championship join nation would mean leav sanzaar would also mean team leav super rugbi sure leagu would join would celtic leagu will take anoth south african team thing worri one year might lose one nation contribut much histori old rivalri imagin scotland england murrayfield etc would horrend
668,aubameyang pass hat trick penalti help lacazett confid remov
669,permainan roulett sbobet casino yang sangat menguntungkan
670,daftar sabung ayam sv388 deposit murah
671,nba dramat end time
672,brazilian starlet lincoln cristiano ronaldo biggest influenc remov
673,agen bola pochettino bangga dengan hasil yang didapat tottenham
674,instagram rugani condemn juve fan milan bu attack remov
675,back wall espn tri someth never delet sport
676,inilah agen poker terpercaya indonesia
677,mario balotelli put neymar bracket talk summer transfer remov
678,daftar bola tangka banyak jackpot
679,reveal simeon plan bring dybala atlético madrid remov
680,wont believ
681,ملخص مباراة تشيلسي توتنهام خسارة البلوز بثلاثيةساحقة
682,twenti year pass sinc bernabeu goalpost came remov
683,tich lead mariana muscl winner saipan news headlin event ad
684,liverpool defend dejan lovren reflect duel man utd striker romelu lukaku remov
685,موعد مباراة ريال مدريد ويوفنتوس اليوم الثلاثاء 2018 والقنوات الناقلة
686,juraj kucka smash ball anger foul score midfield anger saw readi far post teammat saw thing go howev great goal albeit meaningless sinc lost almost end game opposit smash anger like kucka show great deal awar composur spot keeper line despit foul score love goal smash anger goddamn sport shit hole come intern sport meaningless player lot bettor dream crush prayer answer disagre stand smash anger besid look http streamabl com mutjf see keeper even far line perfect shot recal previou rage goal like wayn rooney newcastl http www youtub com watch pphqrpj7tli thu began twitter abus anger know play still go
687,way modern outdat workspac blog allow bot action perform automat pleas contact moder subreddit messag compos sport question concern
688,sport goof podcast back talk march mad make basebal predict discuss end confer nba
689,poulter clinch master spot houston play victori hossler remov
690,villanova roll kansa reach second final three season blog allow bot action perform automat pleas contact moder subreddit messag compos sport question concern
691,bayern pay jame 42m euro purchas option remov
692,way modern outdat workspac
693,report german giant set sight celtic ace bhoy could land huge profit remov
694,peculiar nine element ratio display
695,carlo tevez deni injur prison yard kickabout remov
696,alway blow away invest america everi sport remov
697,offici resign sport due recent scandal remov
698,munenori kawasaki master english languag excit fuck wholesom tell realli enjoy learn new languag awesom man root big guy english easi report ask cri sound japanes guy likabl got two book bro happi got world seri ring cub retir game best kawa http imgur com ndzevpq jpg banana everyday munenori man ye bit tongu cheek respons sinc said son spoke english
699,report milan plot move man utd liverpool target remov
700,jeff van gundi ask second cousin mean thing get realli weird rocket spur game
701,someon yell overr bryce harper proce hit second game peopl see nice crowd nasti seen lot empti game year basebal miss someth expens mani game rather sit couch notic lot guy full cheek protect season new attach great basebal player give douchiest vibe ehhh cold cinci still kid still school chilli cold shitti still across larg part 160 game left littl interest sit degre weather get rain open day move back roughli week last decad make open week game higher chanc colder crappier weather somewhat new began gather steam giancarlo stanton took 88mph pitch face suffer facial fractur dental damag 2014 http instagram com ta6j_nq6lg utm_sourc ig_emb face yep snow indi arent far away red school easter sunday nation fan red poop fun pit cin game across street right thanksgiv worst sunday school lol hour ahead eastern standard time think straight even weekday slow june stadium start sell
702,paul pogba play jose mourinho issu respect choic remov
703,nsndp introduc amend motor vehicl act improv cycl safeti halifax
704,peopl remov warn
705,arik ogunbowal young ladi definit clutch congrat dame mamba mental team consist lose uconn beat semi final championship anyon got streamabl link last shot love well contest final match like instead usual one side beat http streamabl com 8meyi
706,arik ogunbowal game winner notr dame mississippi state
707,hit overtim buzzer beater make championship arik ogunbowal hit anoth one win nation titl new notr dame legend irish
