,text
0,ryan blaney outrun kevin harvick claim first cup win pocono 400 guy know race without function radio race take skill 3rd start work work came back toward end stop work work third race
1,angri nashvil fan tell announc feel live millburi everybodi hate smashvil hero hockey lol jonesi enjoy one bit team win cup might well get coupl bomb air sexual predat millburi total tard reddit think might one clearli idea hockey commun hate milburi pen fan call head like drunk nashvil fan downvot think surviv downvot see anywher comment state support milburi pen fan definit like also drunk fan deliv justic hockey commun talk shit
2,crazi motorcycl save isl man impress
3,bautista get walk steal second
4,watch england sheyi ojo might fastest player world footbal delet
5,watch melbourn collingwood live free live stream
6,texa ranger ticket
7,peculiar nine element ratio display
8,mario lemieux dat dude dude dude delet
9,great indian sportsman person
10,mario lemieux dat dude dude dude delet
11,congratul ref 2017 stanley cup victori man love salt come nashvil fan even though call dumb ass penalti pen none pen clearli favor even though ref job blew whistl vision puck clearli favor pen guess goal went back toronto agre ref call ref lose game nashvil lost game countri music save anymor noth pen better team amirit mean like nashvil capit would insan ref posit led lose sight puck led prematur whistl sigh goal went back toronto would toronto review dead play conclud murray possess fact goal even know nashvil fan nashvil fan salti pretti much everi fan asid pen fan got hockey also pretti hard least upset perfectli legal goal disallow ref assign watch action goal put worst posit watch puck reposit group player got goal blew quickest whistl possibl assumpt goali trap puck fact made pretti terribl stop allow shot first goal game nashvil face elimin game come one goal empti netter least game gone pred gotten chanc continu fight game anyon say well work kid sport biggest stage game complet chang quick whistl ref liter worst spot ice watch shot goal nashvil fan go salti yeah chanc know score taken away took control game gain momentum taken thing game still conceiv goal call ice overturn clear evid yet see view conclus show skate ice point two game ref chang way game play momentum affect team happen stanley cup final certainli game elimin game nashvil fan right upset certainli alon pretti much everi fan pen fan equal piss ruin game fun watch ref take control give unfair advantag one team fairli legal took lead delet back toronto ref discuss amongst decid goal assum decid review sinc challeng allow never confer toronto war room anyon say well work kid pred two full period score goal play four powerplay pen zero one still score like play behind whole game felt like go uphil pen score end final scoreboard mount pretti piss poor final rush end defend miss outbound pass get destroy skate race goal disallow last minut 3rd might agre nashvil everi opportun win game complet fail yeah tough break rule hockey least case whistl actual blew intend blow call happen everi singl team everi singl season usual multipl time notic player carri throw fit like fanbas henc repli thought sure talk go argu think main issu peopl upset goal disallow much disallow stanley cup final suppos best possibl offici yet offici got way far often issu disallow goal game game pred disallow goal went pen bogu penalti team seri long come dude give fan break game gone basic say well ton chanc score pen score puck bounc board back net bounc pekka rinn elbow last two minut pred plenti chanc take one goal exactli perfectli legal goal disallow due poor offici yeah pred plenti chanc score disallow stupid hold demand score besid point peopl upset team ultim get fulli play seri ref got way worst offici ever seen way nhl year absolut deplor offici peopl upset
12,anson sport solut fit equip requir
13,alway road delet
14,rise allen iverson reebok basketbal oral histori delet
15,اینفوگرافی اختصاصی پیش بازی ایران ازبکستان
16,ladi warrior near pvl crown
17,clear album came togeth love rossi delet
18,roach still fantas pacman money
19,دایی مطمئنم ازبکستان بریم جام جهانی صعود کنیم
20,buy futur fin onlin surfboard warehous
21,state origin team kevin walter explain rational behind select squad
22,peculiar nine element ratio display
23,روش سابقه ترین سرمربی ایران مقابل ازبکستان
24,india crush face bangladesh champion trophi semi final
25,track sport perform gadget
26,pakistan sri lanka squar semifin remov
27,monday june 12th hors race tip today result remov
28,big show transform 2017 fit bodybuild motiv delet
29,highlight india south africa
30,tổng hợp tin nóng chuyển nhượng châu 2017 hôm nay
31,bunion exercis ankl invers exercis bunion
32,harga cabe rawit naik drasti
33,winningft บพน นบอลม ออาช หลากหลายเกมส
34,evonikcash com keinginan penyerang chelsea diego costa pada petinggi klub untuk secepat mungkin menjualnya mantan klub yang pernah diperkuat sebelum pindah chelsea kala itu
35,free basketbal skill drill train session loui remov
36,terjadi gempa sukabumi
37,pakistan sri lanka live icc champion trophi 2017
38,finish delet
39,shirtless footbal player men sport footbal soccer rugbi cricket basebal wrestl box fight almost sport indoor outdoor pictur nudism voyeur pic much imag adult pornblog nsfw imag
40,howe leap shoulder 6ft4 guy grab sport ball
41,kemal trophi cibubur dec 2016 women sportsmodel
42,ایران هفت بازی چهار کاپیتان
43,finish delet
44,گفت وگوی ویژه منتقد جدی فدراسیون والیبال عهد دقیانوس نیست
45,syndic gym reliabl supplier manufactur gym equip
46,pakistan sri lanka champion trophi 12th match 2017 cricket live
47,xưởng may bóng theo yêu cầu
48,vijay mallya
49,evonikcash com sebelum menutup akhir musim pasukan skuad utama manchest unit memperlihatkan kegarangannya
50,rashid khan best bowl
51,ريال مدريد يخطف هدف برشلونة بمبلغ خيالي راموس يرد على مورينيو باريس
52,giordana fusion men bike jersey
53,situ judi sabung ayam resmi banyak bonu
54,http youtu p2ynik1zqyq
55,fifa presid say qatar world cup threat mean
56,kid dress buy best kid wear girl boy onlin trend
57,jimmi white ken doherti great escap purpos
58,بازماندگان حماسه اولسان
59,suncorp super netbal melbourn vixen gw giant australia pla
60,shop babi girl dress get exclus girl wear collect trend
61,taser russian roulett la vega
62,wwe monday night raw live stream onlin live stream
63,amjad sabri qawwali
64,معاون اول رئیس جمهور تماشاگر ویژه بازی ایران ازبکستان
65,buy fashion babi girl dress frock onlin trend
66,cristiano ronaldo reportedli becom father twin
67,prediksi bola norwegia swedia juni 2017
68,jeremi howe collingwood take hanger tom mcdonald melbourn today queen birthday match mcg delet
69,sooner men golf celebr championship rememb journey titl
70,rüştü reçber kimdir
71,jeremi howe collingwood take hanger tom mcdonald melbourn today queen birthday match mcg delet
72,collingwood jeremi howe take unbeliev grab
73,watch nba final game live stream free
74,golf lover get rejuven golf experi lavish accommod remov
75,elit gamespe speed sled workout
76,new punjabi song
77,sidney crosbi need 3rd stanley cup prove great anyway
78,post cfb ucf kicker given ultimatum ncaa either close popular youtub channel lose scholarship due use like person earn revenu man colleg footbal would great without ncaa ncaa make money like make money like ncaa student athlet student first athlet second want make money student gotten academ scholarship
79,babi girl dungare playsuit buy denim dungare onlin trend
80,put need gym http www amazon com b06y5jx9yr
81,buy kid jacket coat onlin junior girl india trend
82,hey sport first post wonder anybodi know team everi made playoff final mainli big like guard mostli insignific team spur win championship 1999 three lead scorer tim duncan ppg david robinson ppg sean elliot elliot smallest duncan robinson averag doubl doubl season point rebound orlando 2009 team revolv around dwight howard rashard lewi hedo turkoglu jameer nelson star year hurt star game realli factor get team final year thank guy help finish debat buddi haha
83,popular sport
84,spobit game analys give latest sport relat news
85,situ judi casino onlin rollingan besar
86,buy kid jean jeg babi girl onlin trend
87,video cardboard gregg giannotti brian jone cb visit town latvia
88,australian rule footbal jeremi howe get insan air
89,champion ref delet dumb throw catfish someth let know feel
90,old hindi song mobil app free get mobil devic click
91,icc champion trophi pakistan sri lanka match
92,person would like support tri becom brand ambassador
93,top de activité pour fêter anniversair votr enfant an blog allow bot action perform automat pleas contact moder subreddit messag compos sport question concern
94,south korea consid bid host 2030 world cup north korea best could make origin http www theguardian com footbal 2017 jun south korea presid suggest cohost 2030 world cup north korea reduc bot moon jae suggest north korea could part bid host 2030 world cup accord presid 039 spokesperson park hyun moon said quot neighbour countri north east asia includ north south korea host world cup togeth would help creat peac north south korea well north east asia would like presid infantino interest matter south korea host world cup 2002 japan organis next year 039 winter olymp pyeongchang hope north korea take part extend summari http reddit com autotldr comment 6gs7sb south_koreas_president_suggests_2030_world_cup faq http reddit com autotldr comment 31b9fm faq_autotldr_bot version 142199 dr far feedback http reddit com messag compos 23autotldr comment monitor construct feedback welcom top keyword north korea south presid cup level would theoret help north korea becom open even consid semblanc improv human right issu basic abl provid citizen even basic level need spend money citizen stadium cours becom ghost town brazil world cup use stadium minimum 000 capac north korea alreadi stadium built least 000 capac across citi pyongyang includ massiv may day stadium 150 000 capac would need build new stadium like brazil corrupt govern south korea modern stadium 000 capac infrastructur host world cup alon week notic get away bribe skulduggeri fifa known new south korean presid show kind north long term diplomat mission goodwil benefit north would toler made fool regard global spotlight like world cup someon say human right issu look qatar sure south korea infrastructur host world cup reason person would bat eye lash give one oppress regim nation state reward host world cup lack simpl abil provid peopl even basic level preposter moral logic level know corrupt organis fifa actual mull mark word noth chang north korea get like would becom even belliger probabl enough probabl sinc world cup expand team 2026 would probabl mean citi stadium get world cup bid egregi insult decenc everywher
95,custom golf bag golf bag bespok golf bag custom golf promot golf bag billboard golf bag
96,roll
97,داستان هایی تاریخ فوتبال ایتالیا پیرلی آنیلی خون تازه کالچو
98,daniel nevin joe joyc high qualiti
99,jeremi howe collingwood magpi take mark
100,nile sport
101,backyard sport custom sport landscap servic firm focus strictli design instal top flight sport facil homeown want creat upscal custom home court driveway backyard
102,champion trophi 2017 iipakistan sri lankaii suffer collaps
103,four major type muay thai glove
104,perfect amaz
105,peculiar nine element ratio display
106,nike train club person athlet model name pleas delet allison stokk wow think right
107,icc championtrophi pak srilanka live match
108,carlo vela answer bradley goal mex usa clip fast comment anyway ball stoppabl keeper nice goal nonetheless vienelamarcacióndedamarco velavieneenganchandoseñorasyseñoressepuedearmarlagorda disparo gol guzan depth understand start keeper need retain
109,jelena ostapenko french open stunner one sport biggest upset ever fox sport
110,nba player sebastian telfair arrest gun possess relat charg new york fox sport
111,lead draft day judg take power show anaheim fox sport
112,isportsweb michigan state notr dame rekindl rivalri sever sport
113,bear bull topic erni scatton 1st sport feed appear
114,penguin end predat magic postseason run fox sport
115,bay area sport insid preview game discuss draymond green trash talk
116,champion trophi pakistan need 237 run reach semi final
117,small demonstr lebron incred basketbal
118,even know feder play sampra wimbledon
119,peculiar nine element ratio display
120,game histor florentin footbal florenc look like ref clearli lost control game bob never seen spectacl holi crap pattern pant make look like sag wait american footbal instead beat shit gear tackl beat shit achoth bear hand gear protect lamest shit ever seen life bunch dude squar feet away eachoth throw shitti back forth least tire wop throw ball vice good documentari sport world sport show onlin somewher realli good
121,flame mix messag move
122,rain jacket wholesal
123,بايرن ميونخ يسخر امتحان اللغة الإنجليزية للثانوية العامة مصر الإخبارية
124,junior bison boy announc basketbal tryout 2017 season aug
125,best news delet
126,derek jeter open youth addict treatment center tampa delet
127,رسمی آندره سیلوا میلان پیوست
128,aaron judg frontrunn rooki year mvp
129,bangladesh australia match live
130,fabinho makin dekat old trafford
131,رئیس باشگاه پاریسن ژرمن وراتی هیچ قیمتی فروشی نیست
132,sachin tendulkar unluck mani time remov
133,serena william show babi bump video
134,yalla shoot مشاهدة مباراة المصرى وسموحة مباشر اليوم الأثنين 2017
135,mark henri lifestyl famili salari hous net worth car delet
136,peculiar nine element ratio display
137,sunderland fan give hilari reaction new home kit meme advic anim similar post remov sight pleas consid post sportsmem bot action perform automat pleas contact moder subreddit messag compos sport question concern
138,aussi rule player leap oppon get major air
139,aussi rule footbal player use oppon get major air secur mark
140,track field hurdler finish race slice leg open
141,pontiac silverdom detroit lion former home turf world biggest birdbath stadium death row
142,take respons know differ self blame
143,floyd mayweath book mgm grand august 500m mega fight conor mcgregor edg closer delet gigant wast time money
144,bek tangguh dortmund jadi rebutan klub london
145,soccer fan win internet diy new kit
146,aussi rule player leap oppon catch ball
147,use oppon advantag
148,cristiano ronaldo real madrid forward becom father surrog twin alway score even babi surrog mother could surrog father homosexu proof look sock photo coupl day ago
149,eli5 soccer point system game end tie other point draw leagu point win leagu game end draw cup game also end draw although mean game replay replay cannot end draw one two team progress next round also cup game draw allow usual eas fixtur congest cup fixtur play leg combin score decid result fixtur usual instanc away goal rule mean away goal goal score team play ground import exampl arsen draw barcelona home first leg second leg draw barcelona ground even though aggreg score arsen would score away goal two game also worth note european champion leagu would exampl two stage stage made sever mini leagu draw allow knockout round point rule disappear goe two leg knockout format soccer team play multipl competit cours season game schedul overlap season competit competit held differ countri base mani team leagu team perform last year detail soccer team play point guarante follow formula point win point tie draw point loss main type competit leagu play main focu club soccer club play long season team divis accumul point team point end long season win leagu divis trophi depend leagu set top team stand point tabl get promot higher divis better team next season loser divis might play lower wors divis cup competit singl elimin knock tournament sometim involv multipl divis within countri leg stage tournament may includ home away match would allow tie score leg aggreg end second game tiebreak determin extra time ad depend divis setup countri bigger team may get skip earli round countri multipl cup competit intern club tournament knock tournament possibl group stage round robin point accumul top two usual group advanc standard home away leg elimin goal aggreg entrant determin base differ criteria around world usual base perform individu leagu previou season win worth point draw worth point come play leagu match like premier leagu competit tabl group stage tournament world cup qualif whether match end tie depend competit match game part leagu group stage end tie normal knockout competit tournament need clear victor tie even depend tournament champion leagu copa del rey decid move total score game one home one road tiebreak favor whoever score road way allow tie tiebreak neutral play anoth minut possibl penalti tournament cup match end draw schedul replay home stadium road team game need clear victor day cannot reschedul includ final tournament two differ stage tournament play group knockout group point system win draw loss determin win group move next stage knockout team play round robin format depend tournament either play twice two team tie end stage goal differ goal score minu goal allow decid goe knockout point system win loss think playoff system depend tournament either one game two game playoff aggreg score determin winner tie leg game team away goal advanc
150,sachintendulkar 19th centuri 141 australia extraordinari inning
151,savag dunk time delet
152,oddest craziest creativ contract claus pro sport hell pro softbal team make money play infront 100 peopl eight time year
153,геннадий головкин доминик уэйд gennadi golovkin domin wade
154,open father day bushnel pro golf laser rangefind bundl includ golf rangefind slope non slope function carri case remov
155,ibrahimov releas manchest unit
156,thread needl delet hitboxporn gifv link http imgur com 0wfr7xu gifv bot faq http www reddit com livven wiki gifv bot code http github com livven gifvbot
157,ota matter
158,pak sarfraz aamir
159,pak sri lanka champion trophi full highlight pak sri 12th jun delet
160,conor mcgregor floyd mayweath trash talk delet need kiss get
161,ward kovalev live remov
162,tri come name kickbal team want use popular refer movi song show book want clever well exampl royal tennenbal much appreciatedth derek zooland team kid kick good wanna learn stuff good kickbal hard pitch crazi live free ball hard ballman brother kickpunch kitshick save ball covfef kickbal
163,maserati royal chariti polo trophi
