,text
614,would agre basketbal second popular sport unit state surpass basebal remov differ one say surpass basebal look rate sport get even super team past decad game last night biggest audienc year meanwhil basebal lose viewer two team gone longest without world seri play fulli expect rate drop season basebal game look empti nearli everi time see highlight clear face leagu like rest big leagu basebal hat seen worn fashion support team face guy basketbal rise basebal fall behind also super team argument work nba pariti long time alway team head shoulder everyon els cycl around actual believ nba lose luster rise super team even remot basketbal fall behind soccer soon would agre basebal see downward trend among young peopl slower pace game mlb awar actual tri speed game littl bit realli hard meaning way basketbal surpass basebal popular alreadi probabl within decad hope hockey rise rel popular well think much trend direct yeah caus bull kobe laker lebron heat realli diminish popular nba soccer sport hahahahaha hockey fan particularli like hockey footbal basebal king basketbal problem even keep team afloat soccer sport funni actual soccer favorit sport anyway reason ask hockey fan usual vendetta basketbal reason teach live rel middl class commun tell everi basketbal team basebal team youth soccer team
615,ozzi guillen get second chanc
616,russel westbrook kevin durant steph curri 2008 man jeff green russel style chang much sinc lol man happen jeff green yeah back green still thunder pre 2009 sinc curri still colleg dude walk poptart poptart cost 220 000 000 summer spit water thank diamond incrust lol
617,detroit tiger arizona diamondback mlb pick odd predict sport chat place
618,watch live cricket icc champion trophi 2017 delet
619,peculiar nine element ratio display
620,russian roulett becom american intermediari partner get
621,1st semi final pakistan england icc champion trophi 2017
622,amaz athlet abil post cricket
623,deal pain leg remov
624,hey come guy pay attent delet marin basebal babi curiou would score bautista stolen base error seattl knowledg littl leagu god satisfi one idea wtf go understand base ball walk given ball dead catcher throw ball back pitcher typic one would attempt take anoth base reach first case defens player sleep field recogn runner take extra base technic steal typic stolen base occur pitch case occur way next pitch servai reaction meme worthi yeh like day late felt like gif show everyth except import part happen lot littl leagu marin pretti sure bautista would credit stolen base believ offici score fielder choic pitcher contact rubber make normal fielder fielder made decis throw bautista use littl leagu anytim could score batter guy bat got first base white squar right walk pitcher threw pitch outsid strike zone end play runner batter went second base next white squar run pitcher held onto ball instead throw anoth player attempt tag ball glove touch runner one probabl might unless peopl also read comment comment demand refund marin broadcast better shot score fielder choic mayb defens indiffer intent indiffer lol made decis throw bautista base fact one within feet base horribl score decis addit pitcher could step plate pitcher mound end play noth end play bautista kept go holi shit love comeback know would decid job
625,duti rig qualiti leather polic duti rig avail black hill leather
626,philadelphia philli boston red sox mlb pick odd predict sport chat place
627,болельщики устроили потасовку чемпионате россии вольной борьбе 2017
628,stuart florida deep sea fish
629,england cricket reaction hit groin delet meme advic anim similar post remov sight pleas consid post sportsmem bot action perform automat pleas contact moder subreddit messag compos sport question concern
630,england cricket ben stoke react groin shot eye contact maintain hit phenomen yeah typic exagger train drill well
631,rate favourit cricket mumbai indian
632,minnesota twin seattl marin mlb pick odd predict sport chat place
633,swing seat
634,self defenc class krav maga system delet
635,dale approv top delet
636,batista lifestyl famili daughter hous net worth car bike delet
637,ott girlfriend fill loneli food
638,test fc jw1 julian wilson fin finat com
639,best news seahawk offseason earl thoma healthi happi readi kick tail
640,col pro collect summer 2017
641,bangun poker sendiri indonesia
642,eng pak live stream semi final match icc champion trophi 2017 sports24houronlin
643,espn report mcgregor mayweath delet espn report link espn downvot provid decent sourc pleas expect anticlimact serious sport http www googl com amp www mmamania com platform amp 2017 15794770 floyd mayweath retract aug date reserv conor mcgregor super fight mayweath one best boxer time mcgregor make box debut regardless good mcgregor octagon mayweath come retir make huge payday littl chanc lose conor expect firework first three round box masterclass floyd follow round interest fortun watch mayweath pacquiao fight uncl avid box fan abl explain technic aspect
644,bike ralli weekend fulfil passion
645,joaquin caña idol rafael nadal
646,cricket legend ramadan transmiss sport journalist talk cricket
647,privat basketbal train person coach missouri remov
648,german club bayern munich celebr independ day
649,benefici plan bet soccer clean game opportun remov
650,dynam star trevor trout includ sec team top
651,golden state warrior playoff 2017 highlight must watch
652,congratul remov
653,maut group lalong nagwala dahil pagkatalo cleveland cavali golden state warrior wow sabaw
654,mark hartmann keep girlfriend
655,fuck that good way find get rung time fan often think player share animos toward offici case player coach upmost respect appreci offici highest stage sport umpir get talkin head offic soon enough say total agre howev ima gonna leav http youtu lm0hzmot4nc cup fell alan cup fell suppos see hear delet clue mean watch full video ump call pitch ball get heckl lot pitch team huddl coach soon leav huddl first pitch obvious aim hit ump intent hit ump face pitch disrespect toward colleg softbal umpir yea saw articl whole stori super unsettl agre coach decis disagre field umpir decis call forfeit pitcher lost full ride btw play utah right http www utahut com roster aspx rp_id 1909 ump nut cup fell previou play give ump shit thank explan okay also lack subtleti catcher part god lower mit one would notic lol yeah guess misspok play lost full ride thank yup
656,sato score win goal celebr independ
657,england pakistan live stream icc champion trophi 2017 delet
658,somebodi doesnt fit
659,insan display athletic cricket remov
660,judi tembak ikan onlin banyak menguntungkan
661,sport store onlin india golf equip india
662,lebron jame maglalaro ginebra wow sabaw
663,summer camp affect child self confid
664,watch lionel messi goal assist skill 2016 youtub
665,soviet lifter bail 1981 well problem use bowl shoe
666,wednesday june 14th hors race tip today result remov
667,curri durant paiimbestigahan din aguirr wow sabaw
668,stadium fight boston fan eject yanke stadium west anaheim
669,دیدار روش اعضای تیم ملی فوتبال روحانی
670,prediksi bola rusia selandia baru juni 2017
671,pro evolut soccer 2018 usain bolt becom footbal
672,caña goe full filipino pedicab ride divisoria trip
673,england pakistan champion trophi 1st semi final 2017 cricket live
674,ariella arida need fresh start
675,step get dive master internship bali
676,england pakistan first semi final today watch
677,ott credit team effort tajikistan win
678,southpag delet
679,ang postecogl tread water til bounti ail
680,trik memenangkan terata untuk memainkan poker indonesia
681,great india place
682,وکیل جپاروف رویه فعلی تفاهمی باشگاه استقلال وجود ندارد
683,littl leaguer syndrom live dream record final season last game
684,garden galleria
685,پیشنهاد میلیون یورویی والنسیا برای خرید سردار آزمون
