,text
595,edwin jackson lineback indianapoli colt struck kill suspect drunk driver edwin respect hard work good natur sore miss life short origin headlin espn colt edwin jackson kill struck suspect drunken driver articl stori nfl com edwin jackson die hit suspect drunken driver http www nfl com news stori 0ap3000000914139 articl edwin jackson die hit suspect drunken driver bleacher report colt lineback edwin jackson die age http bleacherreport com articl 2757667 colt lineback edwin jackson die age indystar com colt player edwin jackson avon man kill suspect drunken driver http www indystar com stori news crime 2018 suspect drunken driver kill 304726002 theindychannel com colt lineback edwin jackson kill suspect drunk driver crash http www theindychannel com news local news indianapoli west side colt linebak edwin jackson kill suspect drunk driver crash profootballtalk nbcsport com colt edwin jackson kill suspect drunk driver http profootballtalk nbcsport com 2018 colt edwin jackson kill suspect drunk driver sbnation colt lineback edwin jackson kill suspect drunken driver http www sbnation com 2018 16971370 edwin jackson indianapoli colt death com colt edwin jackson kill suspect drunken driver http www com nfl 2018 colt player edwin jackson kill new york post colt lineback kill suspect drunk driver http nypost com 2018 colt lineback kill suspect drunk driver washingtontim com colt edwin jackson reportedli kill suspect drunken driver http www washingtontim com news 2018 feb edwin jackson colt lineback kill suspect fanrag sport colt edwin jackson kill suspect drunken driver http www fanragsport com colt edwin jackson kill suspect drunken driver fox59 com colt player edwin jackson struck kill suspect drunk driver http fox59 com 2018 struck kill suspect drunk driver citi west side mirror indianapoli colt star edwin jackson dead american footbal star kill suspect drink driver http www mirror news world news indianapoli colt star edwin jackson 11970011 colt com statement indianapoli colt death ilb edwin jackson http www colt com news articl statement indianapoli colt death ilb edwin jackson ec094cf9 c3a8 4524 8fca 73425264297a theindychannel com two men ride share vehicl kill suspect drunk driver identifi http www theindychannel com news local news indianapoli west side kill crash near holt road cb sport colt lineback edwin jackson kill suspect drunk driver http www cbssport com nfl news colt lineback edwin jackson kill suspect drunk driver sport yahoo com colt edwin jackson kill struck suspect drunken driver http sport yahoo com colt edwin jackson kill stuck suspect drunken driver 205315178 html cb news indianapoli colt player edwin jackson struck kill suspect drunk driver http www cbsnew com news colt player edwin jackson struck kill suspect drunk driver live updat washington post nfl player edwin jackson kill suspect drunk driver http www washingtonpost com news earli lead 2018 nfl player edwin jackson kill suspect drunk driver daili news edwin jackson colt lineback kill suspect drunken driver http www nydailynew com sport footbal edwin jackson colt lineback kill drunken driver report articl 3798509 larrybrownsport com colt edwin jackson kill suspect drunk driver http larrybrownsport com footbal colt edwin jackson kill drunk driver 425765 wishtv com colt player ride share driver kill suspect drunk driver http wishtv com 2018 colt player ride share driver kill suspect drunk driver thesun edwin jackson dead indianapoli colt lineback kill drink driver horror crash hour superbowl http www thesun news 5499346 edwin jackson dead indianapoli colt lineback drunk driver superbowl daili star break top nfl star dead hour super bowl http www dailystar news world news 679525 edwin jackson dead super bowl nfl indianapoli colt nfl american footbal nfl com colt edwin jackson kill hit suspect drunken driver http www nfl com news stori 0ap3000000914139 articl colt edwin jackson kill hit suspect drunken driver coltswir usatoday com colt edwin jackson kill car accid http coltswir usatoday com 2018 indianapoli colt news edwin jackson kill car accid thesun edwin jackson dead indianapoli colt lineback kill drink driver horror crash hour superbowl http www thesun news 5499346 edwin jackson dead indianapoli colt lineback kill drink driver horror crash hour superbowl cbs4indi com colt player edwin jackson struck kill suspect drunk driver http cbs4indi com 2018 colt player edwin jackson struck kill suspect drunk driver fansid colt player kill suspect drunk driver http fansid com 2018 colt edwin jackson kill drunk driver tmz com colt edwin jackson dead hit suspect drunk driver http www tmz com 2018 colt lineback edwin jackson dead hit suspect drunk driver bot tri encourag balanc news diet articl think stori select sort articl base opinion perceiv bias neither creator advoc sourc articl respons determin factual correct absolut true daili star break top nfl star dead hour super bowl one headlin like also unbeliev clickbait
596,prediksi omaha selasa februari 2018
597,drunk guy made bad decis delet
598,eagl philli special trick play actual happen first bear vike game delet
599,say delet world cup world stage peopl tune differ countri super bowl center team world cup team world countri also everi year cours go get viewer still call footbal say even usa championship call world champion know say make sens realiti whole lot peopl countri watch
600,우리카지노 우리카지노계열 우리카지노총판 입니다 더킹카지노 트럼프카지노 슈퍼카지노 먹튀검증된 우리계열 카지노사이트 href http casino com target _blank 우리카지노 href http casino com target _blank 우리카지노 href http casino com target _blank 트럼프카지노쿠폰 href http casino com target _blank 포유카지노
601,pl make gif show bradi fail catch chang ball trophi remov
602,ipl 2018 ricki pont lead show delhi daredevil team head coach
603,reveal stori behind spur first penalti liverpool remov
604,awn collaps street light toppl philli celebr feel like pretti decent nobodi die expect wors
605,ipl 2018 ricki pont lead show delhi daredevil team head coach
606,falcon tale ruffl feather plenti pluck heart smart
607,эдди альварес 3аменит хабиба нурмагомедова бою тони фергюсоным
608,super bowl lii recap highlight
609,hundr newspap front page celebr eagl victori super bowl lii includ newspap imag replac tomorrow save whichev one like delet
610,peculiar nine element ratio display
611,prediksi hongkong selasa februari 2018
612,hundr newspap front page celebr eagl victori super bowl lii see especi paper paper imag replac tomorrow save whichev one like interest see countri would mention super bowl cool thank zip file front page http www reddit com eagl comment 7vfh6g eagles_super_bowl_frontpages_pdfs_zipped_great
613,eagl fan celebr downtown boston electr super bowl win delet
614,jordan gill meet craig cunningham brit elimin jdnxtgen bill
615,eagl fan kid danc top car meek mill middl street
616,super bowl result team name lii delet what steeler steel work person mythic creatur think imag cut stuff right
617,get bit excit super bowl great result know peopl made pint worth eagl
618,fulli fund charl town classic back schedul remov
619,best fishfind gp combo
620,world seri mvp springer astro reach million year deal delet
621,buffalo edg philadelphia boston citi highest percentag super bowl watcher last night sabr continu huge draw well despit lose team past decad sometim think thing buffalo stay insid front screen bill fan peopl idea much hate cheat patriot epic win bill fan last night eagl fan billsmafia well winter buffalo mean often walden galleria duff side note love buffalo grew watch sabr lot amaz childhood memori yeah listen shred ragan time quit notic bar hop see indi perform theatr district galleri open etc guy still use get morn show 103 fox recept good toronto turn shit becam anoth edg station yeah lot pretti awesom thing list first two thing came head yeah station 103
622,rusti bridg delet ben stiller portray fiction basebal player meet focker pretti sure rusti bridg
623,manchest unit monitor marcu rashford injuri sourc remov
624,olymp gold medalist mike eruzion boston univers sport psycholog expert adam naylor discuss like compet world largest stage mental tough requir take question live viewer tune facebook
