,text
855,awesom skill wow feel could stand day eventu get shot gifv link http imgur com 0diaklj gifv bot faq http www reddit com livven wiki gifv bot code http github com livven gifvbot woulda hit everi window one kick day give minut hahahah skill
856,mcrner mitchi remov
857,athlet studi mate semi pro footbal player love game class task need upvot win prize next hour help appreci delet ask upvot directli reddit rule http www reddit com rule post remov feel free post without ask upvot bot action perform automat pleas contact moder subreddit messag compos sport question concern
858,prediksi valencia barcelona februari 2018
859,keep eye ball said hell team
860,athlet studi class task mate semi profession footbal player competit like help appreci delet
861,work hard train feel fresh readi everton star eye run first team remov
862,gift basebal supposedli sign super famou basebal player convinc also bought red sox hat cu thought hat pair sock silli thought tobi mcguir charact lizzi mcguir show walter neck william http wikipedia org wiki walt_williams_ basebal inform talk mark tobi prove point lmao walt william basebal walter allen william decemb 1943 januari 2016 american profession basebal player coach play major leagu basebal outfield houston colt 45 1964 chicago white sox 1967 1972 cleveland indian 1973 new york yanke 1974 1975 popular charismat player known enthusiast style play http www reddit com messag compos kittens_from_spac exclud http reddit com messag compos wikitextbot messag excludem subject excludem exclud subreddit http reddit com sport ban faq inform http reddit com wikitextbot wiki index sourc http github com kittenswolf wikitextbot donat http www reddit com wikitextbot wiki donat downvot remov sweet thank
863,live hihg jumpi italian tamberi trost fassinotti today atleticanotizi banska bystrica blog allow bot action perform automat pleas contact moder subreddit messag compos sport question concern
864,met sign todd frazier two year deal
865,read complet ipl 2018 team squad list
866,отжимания широким хватом какие мышцы работают домашняя тренировка
867,heart oak winger patrick razak keen alter play style next season remov
868,soi kèo nhà cái tottenham newport 2h45 ngài 2018
869,fifa world cup 2018 schedul team playoff
870,kinder sport remov
871,answer problem everton fan urg club sign year old midfield remov
872,india south africa 2nd odi highlight part
873,auli snow ski
874,best golf train aid
875,guy play enorm testicl win captain varsiti cup south africa
876,isaac vorsah name saudi arabia top flight leagu team week remov
877,kid sport event remov
878,new shin guard tech gain massiv popular denmark anyon know worth tri new season kick stuff
879,فتاحی برای قانون بالاتر علی کریمی است
880,sindhu lead india win hong kong asia badminton championship
881,alienist uncov new clue
882,learn basic snowboard remov
883,prediksi skor fiorentina juventu februari 2018
884,stori deep sleep buri histori awak shook mani mind horror brutal dent time trauma thrive present never past truth time never pass away flower manchest
885,simpl sure way win sportpesa multibet
886,ballboy spark huge brawl cup final match gotta love 4th offici walk toward hand behind back last angl
887,sindhu say period normal join padman challeng
888,sure end road cont chelsea manag slam watford defeat
889,break gronk hous remov gonna need ludicr poster expect read wall text mani pointless detail point gotta give summari leav frivol info lol bad link news stori mobil know hate
890,prediksi sgp rabu februari 2018
891,cri patriot lost super bowl delet
892,wasim akram defi age dismiss shoaib malik friendli match
893,prediksi sydney rabu februari 2018
894,wwe raw 2018 full show highlight delet
895,manchest unit news analys mctominay perform huddersfield pogba worri remov
896,jack budg sign promot
897,hab talent blog allow bot action perform automat pleas contact moder subreddit messag compos sport question concern
898,prediksi nampho rabu februari 2018
899,cavali make ridicul trade offer clipper deandr jordan
900,tri convinc spur sign aubameyang tim sherwood remov
901,prediksi nairobi rabu februari 2018
902,breakdown discuss team mascot indian fight irish disrespect chang
903,لیست آسیایی استقلال afc ارسال
904,prediksi dakar rabu februari 2018
905,fear juventu tottenham remov
906,cop home patriot gronk rob super bowl week
907,deflat ball
908,какой ваш хронотип лев медведь волк или дельфин
909,prediksi sino rabu februari 2018
910,rob gronkowski lose gun safe super bowl break figur code safe look jersey work wife lineman rich huge secur problem hous broken three time first time left jewelri box untouch dresser ransack cloth closet run mill thiev memorabilia specialist told one shred career insid hous went nfl event hire secur afford terri bradshaw usual paid tab get show gotta feel bad guy knew target goe superbowl lose come home rob hous pat fan aw weekend anyon mayb gronkhousekey thank gold stranger arrang belichick get gronk play one season reveng guy play chess everyon strike one situat like thiev perus obituari see famili away hous funer know encount anyon disturb case certain would one home also reason assur neighbor would like glu set notic anyth suspici go neighborhood unfortun safe market gun safe wholli inadequ protect content prepar determin crimin like know talk otherwis interest read safe head http gunsafereviewsguy com knowledg safe type secur offer lock keep honest peopl honest best part even though rel articl work final score fire alarm secur compani predatori opportunist hope record store differ locat sometim plain sight even pile paper drawer good caught thiev need maximum sentenc aaron hernandez crew delet eagl made sure less superbowl ring take lost superb owl famou person remind life isnt full rose think peopl got rob week actual livelihood taken famou one care stricter gun law crimin get hand edit see trigger emot even sophist secur system noth would get past coupl 120 rottweil rememb read studi done guy interview sever convict hous burglar serv time prison ask best secur system would buy protect home said get viciou dog first final call probabl first guess code yeah consid load logic thing keep hous safe would dear keepsak gun redditsilv damn upvot get joke gronk consid retir edit could read articl thoroughli suppos teacher back 90 draft nfl team 60 cut due heart condit ask say luckiest thing ever happen friend colleagu play nfl die 50 flat broke thiev miss helluva game though best safe one find unless name start basic worth bother safe list safe design control underwrit laboratori extrem expens easili 000 gun size model actual safe figur gun realli safe truli invinc goal simpli slow thiev like gronkowski rob peopl care never yeah wonder made nation news other perhap famou footbal player biggest game year play obvious shitti anyon rob act like joe schmoe come home find watch collect miss erm rais one gun mayb basebal bat hell even one pair steel toe cap boot type scum would also type scum kill dog realiz pat ton call way right lol yeah gronk push way endzon right understand load celeb hire housesitt know peopl weekend getaway year burglar come scope hous see person two move around insid time give leav reddit silver shoutoutto_caboos http imgur com x0jw93q png reddit silver shoutoutto_caboos receiv silver time given smeagoldoesreddit info http reddit com redditsilverrobot ye injuri odd respons leav comment chain yeah rememb see guy reddit built custom bookshelv hid gun incred guy hid small arsen insid medium size bookshelf bad haramb mean total one best super bowl gun gener click like noth els news give peopl want logist perspect would make loud enough racket alert arm robber know element surpris blown sane individu arm hear gunshot hous still great secur emot standpoint lost realli good friend will sacrific keep safe buri rememb sacrific must vain take fight back thiev commit crime get lock find system win game enter hous two viciou rottweil gun hold basebal bat wear steel to boot lot damag mean dog big goe equal angri buddi deal angel tulip rotti go lose game friend halfway decent secur system new busi ventur pro sport home sit athlet everyon know town due championship delet complet make sens rich enough read fiscal respons retir complet destroy bodi lol oop think click wrong repli whatev make feel safe shot head done work use reddit silver redditsilverrobot http imgur com x0jw93q png reddit silver redditsilverrobot receiv silver 2837 time given hypnotii info http reddit com redditsilverrobot one sport talk show said live exclus endors touch salari know career earn true imagin set retir want http www youtub com watch o2bb 6ivfjo mayb neighbor notic loud bark dog follow gunshot
911,year old kid andrei kyle honrada next australia basketbal star
912,آنالیز تصمیم مهم برانکو نیمکت نشینی مسلمان موفق بود
913,ronni sullivan think miss
914,guess highest paid motogp rider
915,prediksi porto rabu februari 2018
916,key googl analyt report seo
917,one manag west ham fan want moy leav summer remov
918,замесы федора емельяненко под биток
919,patriot rob gronkowski home burglar away super bowl imagin quit common extreamli larg popul know gone extend period time come one guy shitti gang damn rob took eagl fan ruthless comprehend hire secur guard week know gronk person financ anyth think safe assum afford bet honestli cross mind guess live bad area probabl someth deal
920,simpl homemad chocol truffl recip
921,still watch 2018 olymp game olymp guid full fun fact need know next week
922,mma fighter knock throw oppon opinion look like revers guy tri sweep leg fighter flip onto head mma mac threat level accur assess mma fighter ever learn yeah shit happen someth like high school judo practic around circl throw team mate one one tire lost focu guy also much heavier tri execut shoulder throw lost grip mid throw teammat back end face plant ground knock disloc right elbow arm swung mid air lose grip guy weight back ad land impact sort understand sport realli necessari take extra jab guy clearli slam head went limp code conduct congratul play alway laugh guy knock keep punch dont see way pick leverag come white dude realli make sort bodi movement see make happen get trip extrem sloppi execut well opinion attack widowmak better actual advic mallard word word happen one time bang fat chick actual take obviou paus realiz guy ref polit thing basic tap coupl time ref call could drop savag shot tri realli harm fight mode ultim will take chanc lose fight nice ref call fight continu full pace damag done fighter due success blow fall ref skill quick assess situat instanc knock dude lucki sinc fighter gear smash unconsci ppl time mouth realis hit meatboard white guy hit due train peerpressur ref call jab look like littl prod check guy actual look pull dude move bodi sideway dude hit head instead watch closer white guy push leg goe push guy rather tie get lock leg could well case fighter danc know power core strength could flare leg twist enough oppon head hit mat first sure could leg also air entangl oppon also sure white short terribl posit center graviti wise even attempt leg sweep bad bot bad bot interest thank yeah realiz harder tell slowmo delet definit revers pure luck guy sweep leg sinc weight back foot lock guy top momentum sweep caus black guy flip sinc weight back leg live name
923,prediksi sisilia rabu februari 2018
924,sport cultur without exagger half time show nonsens sport
925,sampa jiu jitsu spotlight seri
926,harri kane fastest sinc alan shearer score 100 premier leagu goal
927,prediksi jersey rabu februarii 2018
928,buy yonex shb comfort men badminton shoe lowest price sportsuncl
929,گراف شوت های نزن پرسپولیس نقاب طارمی روی صورت منشا
930,magic withstand late miami ralli rare road win
931,munich disast devast chang footbal journal journo let make journo
932,prediksi bromo rabu februari 2018
933,file children fit tax credit tax return
934,gardin hill new head handicap bha remov
935,prediksi omaha rabu februari 2018
936,تصمیم جنجالی کیروش مخالفت درخواست برانکو
937,road victori major motion pictur come soon work screenplay
938,manchest unit star recit poignant poem video commemor 60th anniversari munich air disast remov
939,sport news cricket news bangladesh cricket latest news internationa
940,appropri new york fan attitud toward super bowl lii
941,bradi embarrassingli snub fole super bowl loss delet
942,collinsworth michael much love lose team wow comment 10min close broadcast favor loser remov favor patriot whole way bias comment anoth reason million glad philli second left clock yard breez bradi could easili tie whole game collinsworth favor patriot get pretti irrit definit favor confus fan catch everi review play ham jeez idea catch anymor convolut replay fan longer tell either mind michael much bore bad chri collinsworth absolut aw cringi everi game listen even know anymor cri collinsworthless bad eagl two touchdown warrant review upon review pretti clear probabl peopl watch call field stand kept go thought would overturn continu bitch call stand game move terribl watch footbal fan pat definit notic bia toward pat bradi clear eagl touchdown ridicul said call touchdown touchdown dude liter caught ball possess put step end zone fall bound
943,varsiti jacket wool bodi taffeta liner origin leather sleev sale amazon
944,myhous piaa grey wrestl short
945,rate philli fan scale 100 brief descript remov manic passion put number philli fan say downtown celebr sunday pretti pleas aftermath damag peopl bad noth clean day two nobodi serious hurt arrest perman properti damag look bit crazi mean first championship eagl weird say skin fan dislik eagl least oppon divis congrat win
946,grandpar wait entir live moment delet grandpar reaction guess killer poirot midsom murder correctli edit grandpar seem wick patriot fan congratul get sixth would great awesom see reaction experienc first time especi wait long awesom grandpar luckier felt like forev mid even imagin happi mate famili import thing world agre
947,martina navratilova serena come back slam record remov
948,pioneer catcher roy campanella
949,prediksi hongkong rabu februari 2018
950,nfl coach would play everi time team take field delet
951,fan speak activ mlb player jersey
952,roa jackpot race schedul releas new bonu ad remov
953,year ago highschool footbal team ran play eagl ran superbowl day ago favorit pro team ran play eagl ran super bowl end rex arm sever differ variat play seen peopl run eagl offens coordin frank reich said particular copi bear version bear version http youtu xzrrkll jgg 22 sure belong thought cool doug high school coach make sens love pull trick play biggest call biggest game greatest coach ever good thing tawwwwm bradi receiv end play also sorri second half video video could find play right defenc lot team run sort play flea flicker play tout someth unseen unheard thing see amaz 4th super bowl eagl fsn eagl actual guy backfield alshon jefferi full yard half line http imgur com ljlomkg jpg could illeg format penalti see play least time per year nfl alon mention pat ran minut eagl defens never account pass game especi short yardag situat yea sorri break man one want watch shitti highschool shit bag footbal team perform play seen nfl time would post wast time say lot word word trick watch ask line judg line train ref say obvious call illeg format http www sbnation com nfl 2018 16972192 nick fole touchdown illeg format watch ask ref line correctli train everi play obvious ref agre close enough line sometim word need use need need talk talk
954,extrem relev super bowl case miss open episod http youtu xcy0wk yami
955,스포츠중계 글로리티비
956,cri carter reveal patriot super bowl lii loss impact bradi belichick legaci video delet
957,never seen one futur liverpool fan react arriv south american youngster remov
958,theoffscript classic new year revolut 2005 elimin chamber matc repost duplic content allow bot action perform automat pleas contact moder subreddit messag compos sport question concern
959,agen bola terbaik onlin 2018
960,footbal kill unexpect mean
961,chelsea set stick pressur antonio cont sport news
962,martina navratilova serena regresa para récord slam remov
963,play american footbal around world click link chang life
964,davic cup 2018 defend champion first round delet
965,stack bunch raft move watch water
966,những pha ghi bàn của u23 việt nam lấi hàng triệu nước mắt của khá
967,best footbal highlight reddit
968,mike tyson land brutal overhand right andrew golota love old mike tyson probabl best term zombi punch might kick way http media tumblr com 601344d789774963e36da12d706ceac4 tumblr_mnsnxinckz1qdlh1io1_r1_400 gif tyson fuck golota like car wreck fight http www independ sport gener golota multipl injuri tyson fight 636895 html andrew golota remain hospitalis today suffer concuss neck injuri fight mike tyson quit second round wesley yapor neurosurgeon treat golota said fighter sustain concuss fractur left cheekbon herniat disc fourth fifth cervic vertebra sustain anoth seriou blow head could becom paralyz yapor said way would allow enter ring second round amaz watch mike come rank back day fight event miss proper gfycat url http gfycat com freshicybovin bot bleep bloop http gist github com imjusttoni cb3457e36f22123eb93864f0af639da3 sourc code http github com imjusttoni gfycatdetailsconvert even current state could still destroy peopl tri pick fight sweet momma baw gawd voic probabl fight tyson test cannabi afterward result overturn unreal power speed nonetheless caus saw felt like somebodi lie golota alan pure power techniqu think cat go pretti good hear nonsens time debat differ era move michael jordan supposedli better player today quarterback supposedli bigger stronger today horseshit ye sport chang rule chang equip chang superstar era would superstar modern era would modern advantag ad skill set offens freak show nfl qb better nonsens human ever threw footbal better bert jone year ago could hit head yard full stride ali would heavyweight champ today orr would human highlight reel today space age equip ted william would worldwid sensat basebal god today real question would today superstar compet transport back year yesterday equip rule least bite ear glass jaw mike pussi sorri tiger still defend steve mazzagatti damn got knock 12th centuri still tri get back look like alarm ring 5am mistak think late work huh see call might kick way ummm think confirm first profession fight end insid round right hook liter end peopl yeah pussi grade troll young tyson stone cold killer grew watch tyson biggest critic tyson time go tyson match wast money end first round trevor berbick win titl still berbick wobbl fall http www youtub com watch wawu1dgycec love watch tri hard continu
969,سایت فوتبال مقدونیه نایدنوف پیوستنش استقلال همه غافلگیر کرد
970,glen davi aka big babi davi delet
971,스포츠중계 글로리티비 해외축구중계 nba중계 서비스 remov
972,thunder lightn highlight dubai carniv card remov
973,interest fact steph curri delet
974,kisah pana ngew sama bule
975,ipl 2018 cricket bet tip guru jimmi sharma
976,troy deeney middl finger celebr chelsea remov
977,eagl fan celebr super bowl win crazi unhealthi way
978,american crazi superbowl delet guy riot cricket match reason biggest event biggest sport countri philadelphia weekend find answer bob vagen
979,real madrid tip beat psg bayern boss jupp heynck remov
