,text
306,ousman dembel debut philipp coutinho debut barcelona
307,hasil skor akhir pertandingan spanyol cup februari 2018
308,eagl come meek mill dream nightmar superbowl
309,liverpool join race sign donnarumma remov
310,edwin jackson indianapoli colt kill car accid
311,risk point shot modern day nba nba viewer driven busi three point shot excit good team meant anyth lot would differ profession sport agre although real basketbal fan find non stop three point shot quit bore optim either see http arxiv org pdf 1604 05266
312,best superbowl ever million buck drain first commerci tri offend anybodi
313,psa super bowl stream nbcsport com work app xfiniti stream remov
314,nice kick gostkowski remov
315,fortnit delet
316,gari woodland win wast manag phoenix open play remov
317,2018 goinv year 2018 delet
318,nick fole receiv super bowl invest either team jump seat joy process play could ask footbal fan one best footbal game watch lol holi shit intens congrat eagl congrat nick fole nobodi gave chanc amaz almost like longest yard huge middl finger tom bradi per nfl research twitter fole first player throw catch super bowl big dick nick undraft player get snap hand anoth undraft player throw backup dougiebal hour sunday night whole countri eagl fan delet think one greatest superbowl play anyon els watch super bowl right fole bradi trick better trick better realli happi fole get much credit season take wentz pretti happi look familiar lionsinthesuberbowl http twitter com worldofisaac statu 947568643327647744 ref_src twcamp 5eshar 7ctwsrc 5eio 7ctwgr 5ecom appl uikit activ messag ive seen play waterboy congrat big dick nick fole prop eagl stay bold season seriou payoff suck new england must pick westlak http twitter com sehlinger3 statu 960320042905808896 first quarterback ever catch touchdown super bowl someon eli5 narrowli legal someth shotgun lion matthew stafford exact play earlier season glad work well made say wow show bradi done wide open well best defens ever seen like stood whistl twiddl thumb second sprint end zone dooooo see run never get old greatest play superbowl rememb trey motherfuck burton say play game opinion lineman caus fumbl play amaz bradi tri fail one realli cap turnov sack game squar kick field goal would 000 fan either team still love play still true downvot make laugh hard enjoy loss sore loser matter think either team fan certainli gave damn good footbal game pencil ear realli necessari gotta admit cheekier fuck dynasti elit like bradi catch super bowl touchdown like cut whoever jib made call ballsi salsi fuck show tom bradi done play game definit play game bear nick playbook wtf gator burton super bowl hard time colleg steal detroit lion play anyth better amaz play anoth day fantasi footbal risk paid well understand good edit thank everyon even notic quarterback receiv snap defens watch mobil portrait orient right johnni sexton drop goal sport moment weekend watch like fifti time poetri motion bdntgk look matt patricia face jesu special guest appear bluto mvp play night play realli well glad team best part even need trick play smith wide open middl end zone well holi shit end freez perfect hahahah hug end play straight tecmo bowl realli one best footbal game seen life slow moment game everi play big intens especi play due pat tri unsuccess lol unexpect yet great outcom eagl trey burton one time florida memori recal got love matt look end video play one squar second quarter number love doug pederson clearli illeg format ref miss need peopl line scrimmag liter someon job count snap tfw illeg format illeg funni everyon ignor rule play scienc let air footbal peopl loos mind weird illeg format seem like eagl enough player line men backfield illeg format yay sport nice thing acut see trick every1 readi move forward slowli two defend area actual relax bodi languag clearli show think noth happen next second hell one even look differ direct check posit guess illeg format fan either team yeah flag felt like everi drive big play game nail biter start finish mention 4th convers wait whole life easi cheesi whoop school yard bullshit ride wave like bitch bet play pop eagl coach mind soon bradi drop ball even fole bodi languag slap face bradi pat tri bradi leisur stroll step snap would cocki arrog misstep ever fole pull toe whole time eagl stole idea patriot year ago pat play eagl http www youtub com watch uxuzsj9btjg featur youtu nick fole go histori statist anomali tim tebow would much better nicknam given highschool nichola dick less nick dick http youtu igrk383t0m4 new nicknam meme unrelatedasid hope consid play illeg call back edit wow read rule peopl thought one thank jim meh short stoke keep say lion payoff super backup insult quarterback receiv forward pass backfield line shotgun format quarterback start back distanc offens line would elig start posit believ announc mistaken though move backfield posit outsid line snap even start center would still legal far know need player line see replay eagl except line ambigu 7th player receiv top rule suffici close offici count 7th player son ball snap run back snap anyon gave cat come toward worri talk posit older guy threw guy end zone caught point gryffindor even fole move whatev spot wouldnt set least second snap elig edit would anyon downvot comment liter question elig opinion thri last game season actual beauti play realli sold pat tri draw offsid see secondari kinda stop pay attent safeti complet bought make play unreal fake perfect penalti illeg format well opinion kill bill vol better chicago agre close game height sport blowout suck fole ran high school jim schwartz philli coach use lion head coach might play tradit quarterback player actual throw ball everyon els catch block instanc see quarterback sort step right someon els one expect receiv snap ball get thrown one guy leg quarterback suddenli play quarterback real quarterback run endzon one one would expect play like prepar normal quarterback throw ball catch case trick team hike differ player threw quarterback sort pretend part play also patriot tri similar thing earlier game except tom bradi patriot quarterback drop ball basic involv three player thing complet outsid job descript situat mistak give ball anoth team kick field goal three point would tradit decis point nobodi paid work flawlessli trick play happen everi someth realli rare occasion see runningback throw sometim even quarterback call halfback option play sometim wide receiv across field receiv ball behind line commonli refer revers rare see wide receiv throw certainli tightend whole thing lack better express halfback option fake fake revers turn tightend pass make matter wors whole play decept begin tri sell defens mere wait clock wind draw defens offsid make jump delay game penalti might got issu yard make differ field goal actual snap ball surpris everbodi fake two trick play pull third one sleev trick play follow footbal seem like pretti basic toss catch anyon wanna explain make special ye clearli illeg http www sbnation com nfl 2018 16972192 nick fole touchdown illeg format right wide check line judg ball snap make sure line call waaahhh salti boo hoo nah rule nfl colleg edit clarifi nfl five men backfield penalti mere seven men line rule technic event count one wide receiv two tackl two guard one center one elig quarterback tightend line math fail eight player even argu fole close enough burton certainli front foot never one yard behind line nah mate fole smith line scrimmag snap player backfield bet bring plain hummu parti eas confiden fole use sell incred weird cu soon line said look like go direct snap henc name trick play tell probabl watch lot footbal sinc call end zone area pat done exact thing fole line even see check match motion space behind lineman wrong per nfl rule offens team need least seven player line schrimmag hey exactli seven wrong jefferi got ahead ref player look side judg see posit permiss hell yeah man nick fole play mind mad big throw play need great enjoy got fri cross eye pat fan lol pat fan whini bitch guy ran similar play 10m prior bradi run like truck hard catch footbal allig arm lion ran play last game year lion small way actual made super bowl claim work week yep total first time ever play run tom bill invent serious believ play stolen pat drink kool aid direct snap someon use receiv probabl known trick play longer aliv half point say fuck fail attempt exact play earlier fuck pat great win eagl eagl realli stole play form pat seen come instead get cuck way lmao pat still fell lol two year ago eagl differ coach staff feel like tebow thing transcend past relev convers abil becom like captain jack sparrow everi footbal fan tebow fan far worst quarterback ever heard tebow heard like idea mediocr person someth skill wise enough flair infami mani year line peopl still rememb name often name realli get thing done skill lot career like polit good politician need kennedi tebow probabl still outreach chariti name alon eventu add lot good world goe week year nfl career usernam check whip throw tabl show shorten nick littl dick nick also popular one jack dickleson hey sinc seen bachelor parti reddit nobodyask illeg lol right salti eagl fan downvot top frame yard behind lo puppi bowl yeah line scrimmag execut great receiv line scrimmag realli explain legal fole elig receiv though explain happen iamverysmart footbal player horizont motion snap one question believ debat point format legal interest see first time watch patriot fan actual penalti often time line line scrimmag point sidelin judg signal line ref acknowledg often ask receiv back step see line scrimmag better call penalti need common footbal knowledg ever play ref bad idiot post still pictur call penalti know find full clip see actual even see arm go ref start signal hey line scrimmag back see play sassi bot mean schwartz fire year ago lion use play year think jbc thing obvious invent play good one seen nfl person caught person threw wide receiv made even better fact pat tri play earlier bradi drop quarterback caught pass first time ever someon thrown caught superbowl see quarterback line nickelback spot defens expect full court press instead eagl ran pick roll allow point guard set pick front court quarterback catch yard shovel pass score guy usual throw ball instead caught ball thrown someon usual throw ball watch sport year understand happen nbsp guy catch ball end zone quick bitch basic dictat play playmak feel orchestr conduct fuck show caus made metal got bee knee done john cena bitch time yea saw matt chatham thing vent right cri lol player backfield would also illeg way man fole smith even close line scrimmag ball right yard line clear day edit peopl obvious know rule think three peopl backfield wrong dead wrong funni thing realli think peopl back field would also illeg know need line scrimmag line scrimmag player front foot line behind offens line heel behind line scrimmag get invit actual look relax look back run back defend move past yeah sorri watch play off superbowl give two shit team done neutral fan make observ matter must player line scrimmag guess judgement call ref appar yard half line still consid line scrimmag alway protect mcnugget got shake make quak line movi funni part pat tri similar play minut lol quot movi like certain kind moxi fole ran exact play highschool sure also sure bradi drop ball influenc call saw report practic total time postseason sourc live philli watch read local news lol yea pop warner state championship game use exact play roughli year ago simpli call quarterback throwback fli eagl fli disagre probabl pick nicknam reason actual got pant got religi pussi broke blew atheist tri avoid whole nearli headless thing need player line scrimmag clearli edit wow sorri downvot fact peopl get high hors ask sidelin ref say okay tell move consid line back yard give advantag made play possibl butthurt pat fan look bitch exactli illeg format penalti fole move right side line player right side line elig receiv player end elig reciev posit name tight end name man ask eli5 liter explain way year old replay hello chang fact hope game put bed whole ref patriot pocket thing full clip http giphi com gif 26dnefdeper8ortug receiv appear ask judg line right yet player one first point social media illeg format add fact 4th near goal line mean ball would turn team well leav point tabl import game american sport nickleback slot look play graph close allow backfield stop show look seven player line noth illeg got burger got burger got burger well got burger pretti much exact play usernam check ye receiv tell ref line ref tel move forward anyth deem line scrimmag even though total agre idk everyon problem evid actual happen ref would okay line behind offens line ask see gif doesnt cover entir pre snap give advantag clear defens elig receiv seven guy lo two end elig receiv five middl inelig advantag rule said anyth advantag talk rule book except alshon check offici snap said good would stupid ref threw flag eli5 eli6 smarti pant haha grew mansfield mile schafer gillett stadium agre illeg format illeg ref deem far behind line case point ref state he yhe line obvious ref knew man lo back ref would told anyway could see ball offens line happen time game ye say allow backfield remain player line line scrimmag line scrimmag would inelig usual seen special play special team play said peopl back field case player line scrimmag illeg realiti play happen player line scrimmag player behind line make also illeg line alshon pretti wide line scrimmag state earlier judgement call ref yeah true sometim receiv ask ref close enough far line enough least video realli see honestli see ref approv posit line realli even close he clearli behind offens line ref okay ye anoth angl show entir presnap http giphi com gif 26dnefdeper8ortug appear jeffrey ask ref moment line butthurt proof http giphi com gif 26dnefdeper8ortug fault entir sort look like alshon foot insid head hang bit ball yard line legal line far back still legal format right complet judgement call good one imo imagin call play back say team allow play far line show histor ref call would consid preced mean format legal consist call matter field may see anoth video see point offici ask got thumb henc legal guy far everi game video http giphi com gif 26dnefdeper8ortug took second googl find see difficult whing internet requir effort got link video realli guy line scrimmag usual line behind offens line statement correct refer alshon line top screen would 7th player line video see point ref around second mark see ref assum respons thumb like alfredrwallac mention sinc alshon move flag
319,trey burton pass nick fole 4th
320,post superbowl mental breakdown
321,look today superbowl miss kick game topic came watch game far sport savvi topic titl tri googl avail anybodi help figur higuain world cup final sure think blair walsh probabl involv fuck puta sampaoli thank call ever meant american footbal sorri thought superbowl woulda specifi get joke shit cost argentina joke
322,top great footbal lost money new 2018
323,salah show class brilliant gestur young fan follow liverpool spur video remov
324,ballziest play time eagl
325,chanc win squar box pool number flub kick game eli australian superbowl spent day complain useless number combin winner famili cumul bought add fun pat fan squar pat lost centuri money yeah pay bar tab either lifehack freak babi ye box pool peopl buy squar win money base last digit score end four quarter common point score american footbal common super bowl today score halftim
326,tom bradi made patriot lose greatest super bowl ever 2018
327,mike schmidt signatur delet lol glove made print signatur even close total differ lol well figur sport fan even know glove wound box storag unless waay back play backyard basebal
328,justin timberlak halftim good better perform janet jackson stage nsfw tit think paint star nippl stunt design draw attent away michael trial time 2004
329,superbowl selfi kid definit shit pant though think thought justin bieber kid creat next meme sick see next month kid need stop stare phone like clue what go sure kid knew happen knew camera definit got spook realiz shit tri look inconspicu reason conclus
330,wow justin timberlak halftim show awesom delet horribl serious watch show lip sync instead sync kati perri way memor agre
331,world cup scout daniel arzani socceroo iran elig peru lock pre fixtur remov
332,cricket comment rant umpir call minut lunch break run remain score india 117 chase 119 win delet
333,latest wentz toss pass warm up eagl
334,mlb insan pitch
335,tonight 00pm eastern philadelphia fan car public properti delet
336,think could ever come time patriot good win peopl kind come hate remov ye everyon hate except fan peopl root team like yanke smell strong sarcasm think happen decad ago yanke fan despis
337,footbal payer dele alli sex footag leak
338,tide
339,angri tonight game save game cowboy fan matter win go mad haha understand even watch footbal
340,plan got dick
341,think patriot go win one everi super bowl appear delusion remov everi appear giant
342,topic question remov never compar pat spur spur thing right way need cheat pure class bunch ass clown attitud cheat
343,number pat fan cri pass remov
344,appl reportedli look new iphon bug break phone call
345,hockeyplayersasmyfavoritevin hockey affect remov
346,bud knight
347,player miss super bowl lii
348,tottenham hotspur boss make incred claim follow liverpool draw remov
349,expect next season remov
350,cleveland way super bowl
351,nfl team super bowl upset big game eli man odel beckham giant time live delet
352,watch super bowl goe
353,caught delet
354,absolut breathtak delet
355,berlusconi rule futur return milan remov
356,dele alli leak tape nsfw
357,soi kèo nhà cái watford chelsea ngài 2018
358,tom feel okay delet
359,free nfl stuff
360,anyon catch scientolog commerci nbc remov
361,wonder paid soccer stream site canada remov
362,patriot cheat
363,search jacki wallac life nfl
364,superbowl commentari remov
365,spike littl giant grew gronkowski delet
366,win super bowl delet
367,eagl strip tom bradi get fumbl two minut super bowl delet
368,chri collingsworth even understand footbal remov
369,remov
370,patriot remov
371,someon explain ertz could overturn logic overturn would receiv goe ground process make catch catch consid complet receiv finish go ground lose control ball process ertz would mean ground impact hand ball hit move could consid use ground assist make catch would render incomplet instead correctli imo rule caught ball cleanli stride becam runner possess fulli establish dove end zone due runner statu soon ball cross plane play end action moment factor chri idiot way would turn cri collinsworth worst announc sport ever heard watch nbc footbal got superbowl forc everi damn thing say idiot enrag includ idea either catch catch dog fight like underdog gener team play think ref great job made correct call cri know talk announc know much life know catch overturn would one greatest disgrac insult name profession footbal sport gener caught clean turn runner comment intent confus viewer cri one worst come amount viewer prime time game pull announc catch rule view bad clear cut catch tini thread logic could use overturn argu ertz fall whole time nobodi least one eye would say abl stay upright volit take whole step establish runner movement toward ground could avert entir want chose intent dive endzon break plane runner cannot cant could overturn ref got paid enough chri collinsworth tri best devin nune catch nice tri collinsworth dez bryant non catch http www youtub com watch 1khk6i bf jess jame non catch http www youtub com watch uzr48atf7nw interpret rule past think two tonight two link catch inconsist applic rule troubl fuck recept runner took fewer step collinsworth bias moron catch ask jess jame steeler tell fuck play catch yard line pop like incomplet pass jess jame would like explan well correct answer say one thing debat stem almost infinit gray area rule fall ground mani step take consid fall fall continu downward motion toward ground lose abil move horizont power pat fan call correct rule fuck stupid edit realiz tuck rule game best argument lean dive second step third upright fulli becom runner start process fall maintain possess throughout entir process comput caught ball yard line took two step point runner ball cross plane goal line play catch rule either way chri collinsworth pat ball half run three rout tri get field goal rang say play run time realli tripl play run time slot receiv rb fuck collinsworth also pat fan eagl slug best team jess jame say wrong consist issu nfl touchdown contest fall prior contact could said still receiv runner bullshit rule one guy seem upset patriot get call everyon hous cuss like dog tri convinc overturn fanboy half right thought exactli think mean overturn would help either said condit receiv satisfi becom runner instead gave person worthless opinion ye ye ye ye ye would give 100 upvot could post clearli catch footbal move cross goal line cri dicksworth say ohhhh man sooo close clearli challeng listen gari danielson alabama game stand smug asshol plenti other way wors way wors cri collinsworth worst announc sport ever heard guess watch lot sport romo next year pl rule claus determin exactli receiv turn runner saw receiv take clear control ball mayb one foot alreadi ground take two full step fall last turn leap toward goal line rule say fairli subject get stride get hand ball hand turn went upfield yard look replay prepar dive second step lean back leap third upright past first step screw field goal neither obvious caught ertz catch tonight two hand firmli around ball took two step strong argument third cross plane end zone watch video case ball came catch ertz upright caught took step dove end zone ertz got hand ball outsid yard line though footbal fan first one seem like weak call second one seem like could either way sinc still dive ball hit ground catch tonight clearli take sever step dive score first video link similar clear second video link fall catch move case think fix rule possess ball cross line count touchdown otherwis receiv caution maintain control even mean score think jeep commerci opinion pretti clearli differ jame catch cleanli fit languag go ground process make catch ball come grip land complet catch ertz catch ball cleanli run take three step hand dive end zone tri carri momentum forward sinc guy hit longer need complet catch break plane ball took two step leap catch way would catch anywher pat fan agre best team bro holi hell game lie game hurt girl break heart go long coupl month non stop falcon fan talk shit live atlanta feel subject go ground rule catch seem fairli clear catch made player secur control ball hand arm prior ball touch ground touch ground inbound feet part bodi hand maintain control ball fulfil ball long enough clearli becom runner player ball long enough becom runner second foot ground capabl avoid ward impend contact oppon tuck ball away turn field take addit step see item start lean leap second step third doesnt look upright catch start ground intent lean second step prepar leap make confus well opinion microsoft better sharon needl go long coupl month non stop falcon fan talk shit live atlanta make sens still gave lead lost chang anyth haha guy gave lead fourth quart wait atlanta fan probabl
372,philadelphia eagl winner 52nd super bowl remov earli like porn
373,offici eagl superbowl victori compil repost duplic content allow bot action perform automat pleas contact moder subreddit messag compos sport question concern
374,new fumbl remov
