,text
469,earli entri discount expir june
470,let take second look cano call feet total remind kanagroo feet skip everi leg day life concern snap right dunk remind sideshow bob feet anybodi get pair flip flop fit feet sorri circu wear clown shoe believ jam lebron ass man must take lot energi get thing move get speed hope everyon see foot problem past posit guess save belt must move someon take pano read aaa surgeri screw problem feet narrow feet legal babi dude wear clown shoe feet need hit gym look lil bird leg skip gym complet dude bench 185 come pro unlik krusti tini feet realli lebron still averag tripl doubl seri final mvp score game might look littl funni fuck effect list 240 lb lanki amaz shooter look awkward shit he stud doubt unless paul georg come cleveland lebron last championship though unbeliev lebron use weight measur fit decept think true lol took one close other far behind use pictur measur fit also decept mention way pay guy worth new contract time come around iirc steph pretti heavili underpaid make less dray klay last contract right realli start light thing shoot injuri concern ankl realli think caus that even bron think yup agre think keep curri let drag klay walk want much think small move beat absolut reliabl bench reliabl time reliabl time cal sex panther
471,kevin durant king slayer nbafin
472,make kid like one nba player basketbal jersey kid get http hfbhr9hwxe nba jersey http ue1cf4kslp
473,accur site tom bradi workout
474,asamoah gyan wear customis armband face
475,footbal legend david beckham son romeo beckham recent show support father fashion brand
476,paul bell 14yr old
477,becam first black woman win ncaa singl titl idea remov
478,favorit use protein powder non protein shake
479,ship fee newli maison martin margiela male leather sued upper shoe 100 perfect qualiti remov
480,first black woman win ncaa singl titl wow first black player win singl titl either men women sinc arthur ash 1965 follow tenni close still surpris assum william sister went pro without play colleg regardless sure feel good great accomplish earn congratul
481,warrior declin white hous visit delet good pathet agre white hous pathet
482,perspect shot make kevin durant look tall also cut shumpert hair wanna ten feet tall well tall wingspan understat actual
483,singapor argentina full match highlight jun 2017
484,pakistan sri lanka champion trophi delet
485,spell caster contact high priest odiva sear via unuroseberri gmail com whatssap number 2347013414937 blog http babaodiva skyrock com
486,kevin durant fan beer jump mouth beer suddenli mouth foam realiz spit liter entir mouth foam beer neither fan okc beer foam foam beer
487,ibrahimov akan kembali milan
488,owner leav soccer fan baffl cryptic yet bizarr tweet
489,jean pascal eleid alvarez элейдер альварес жан паскаль
490,peculiar nine element ratio display
491,killer bouncer face batsman get injur delet
492,warrior unanim declin white hous visit per report delet
493,mrw cav fan hear warrior decid skip whitehous visit delet meme advic anim similar post remov sight pleas consid post sportsmem bot action perform automat pleas contact moder subreddit messag compos sport question concern
494,lebron jame gloat greatest loser time final loss get wrong second goat goat remov
495,kind sorceri delet thank submiss sport unfortun post remov compli follow rule titl must descript post cap overli bias editori gener titl hashtag emoji symbol allow titl attent grab gener like check watch amaz incred etc remov
496,upper mustang trek semi independ tibetan kingdom
497,euro fashion black white latest men soft breathabl design premium qualiti king slip shoe remov
498,russian roulett first game basement
499,nfl first femal player
500,help anthoni brow kenobi hope
501,know sad know sad lebron anoth time great perform greatest final perform time expect think less lebron scrub alway root team play
502,airsoft cqb war
503,anyon rememb kimbo slice look ear flop around first time saw kimbo backyard fight pretti sure knock dude eye socket rip kimbo man damn legend damn man ear look like sad biscuit flop die last year heart failur fight understand realli nice guy ear complet explod end fight like birth alien kimbo haircut pick pick rememb like drake josh movi kid either one guy delet rememb rememb break fight backyard cameraman warn watch metal thing small satellit dish pole set middl backyard iirc kimbo work bodyguard porno guy set fight anoth rip black guy kimbo sick head movement fight wow sick one 360p youtub day good time mention ama http www reddit com iama comment 3zi8e8 i_am_kimbo_slice_ama cymdvsa good knock weakass street thug pop eventu may even fight almost certain pick fight kimbo want bloodi mess depend count profession fight includ unsanct bout pretti much undef underground brawl back realplay thing fuck gross jame thompson great fighter though entertain brawl career prior first fight pride japan ask interview prepar career mma repli well watch lot dvd kind fight commun meme meme thing
504,stori behind kevin durant jersey number
505,bullock cart race india incred india run bull 2017
506,peculiar nine element ratio display
507,differ greatest talent lebron probabl talent basketbal player seen greatest basketbal player seen scrub anyth could said tom bradi plenti qb nfl talent bradi greatest far scrub either great transcend stat natur talent well put player fit categori take account sport basketbal great opportunist best combin person talent good fortun play good franchis buy think lebron get titl play warrior duh think point championship measur great pretti dumb make bill russel greatest would good media thought way need creat stereotyp stir controversi get click gonna stop
508,draymond green save klay thompson major injuri sportsmanship good see kyri help play also sure major injuri would occur hell catch sure potenti injuri good catch draymond good kyri help find kyri help suit major titl glad catch could easili broken arm land
509,redskin name new former doug william ascend senior player personnel
510,even ken block get replac robot
511,except skill handbal player take penalti delet know noth sport wow delet last time post top comment remark last time post top comment remark chariti match say get top comment say get top comment chariti match damn hook know could throw slider handbal hard comprehend cool nice hand feet pretti sure legend match rather competit one clap well exhibit game probabl everyon nice know play handbal canada goin pretti sure canada lidl canada
512,father day open special next golf 0803 smoke cobalt gap sand lob wedg set remov
513,stephen smith apolog kevin durant mom first take espn
514,bcb
515,india kyrgyzstan sunil chettri goal 2017 asian cup qualif
516,کفاشیان اگر شورای فیفا رفتم برخی دوستان ناراحت شدند انتخابات کمیته ملی المپیک شرکت نمی کنم
517,chainsmok coldplay someth like song
518,warrior unanim declin white hous visit per report alreadi wide debunk front page
519,golden state warrior respond trump white hous invit
520,تیم ملی دیدار رئیس جمهور رود
521,messi ronaldo could land troubl reason
522,http www ifynitysport com 2017 offici roma appoint francesco html remov
523,situ domino onlin bonu terbesar tanpa deposit
524,predict next year nba final game season team make month long playoff come two team check adam silver mention herd coupl week ago pariti concern thing may look season well thing stand june 2017 whole heartedli believ final match 2018 unless lbj tri forc hous clean backfir nba definit signific pariti concern pro leagu imo regular season neg effect moreso leagu like year wont watch knick make playoff cleveland somehow end player better livingston hard pencil cav celtic cav warrior bonus cav warrior sit star player throughout season rest playoff run screw nba fan bought ticket week advanc displac probabl new warrior fan want see curri westbrook okc year great curri arent play need way nba season becom watchabl next season celtic get fultz somehow either griffin hayward give cav run west lock matter celtic someth shake cav worst pro sport titl seen ever yay nobodi impress behind bradi format bell left johnson right julio motion let see spur get cp3 crown anyon big fan futil sixer could competit kawhi gotten hurt boston joke wash give cle competit get bench mia much better east playoff would knock boston gotten problem boston problem cle kind rivalri neither team hate one anoth one bore ongo rivalri recent memori ask spur would wipe ton alreadi right lot room clear think cp3 automat jump top west would love turn way agre season everyon pretti certain go see repeat final last year damn near unanim solidifi move would see team mayb hand team spread across confer could potenti challeng thing stand right definit bore rivalri hard fought peopl scream earn passion team replac greed individu legaci build
525,newtodaynew com العراق يتعادل اليابان بتصفيات كأس العالم 2018 فيديو
526,etapa del tour suiza 2017 último clasificación gener colo
527,kid hounslow got 82000 fan start mexican wave delet
528,kid hounslow got 000 fan start mexican wave
529,spanish author accus cristiano ronaldo tax fraud blog allow bot action perform automat pleas contact moder subreddit messag compos sport question concern
530,franc england stream friendli intern live free watch live stream
531,newtodaynew com بالفيديو منتخب لبنان يفوز على ماليزيا ويتصدر المجموعة الثانية تصفيات اسيا 2019
532,miss target got target
533,goobta wararka sport ganacsiga iyo madadaalada
534,spend day radio silenc avoid see score disabl scoreboard video replay get spoil onlin nba game delet
535,franc england live stream broadcast score channel info sports24houronlin
536,game tic tac toe
537,detect whether child need orthodontist la vega orthodontist
538,nba final finish believ store futur cleveland cav paul georg kevin love trade seem like happen consid threat warrior super team remov
539,jadwal live pertandingan conf cup juni 2017
540,per multipl nba sourc report right warrior go white hous untru may god rain fire brimston head sad delet remov delet lol report worri alreadi report bring polit sport sub reddit delet report call dick head internet snowflak delet mayb valu insight one decid sport sub good place post polit bullshit delet think meant obvious insight least valu
541,saturday giant home crowd super high re zoomabl imag
542,cameroon colombia today live stream score friendli seri sports24houronlin
543,milan open talk psg gregorz krychowiak
544,hasil skor akhir pertandingan conf cup juni 2017
545,neymar best
546,michael jerom irvin retir american footbal player actor sport blog allow bot action perform automat pleas contact moder subreddit messag compos sport question concern
547,situ bandar ceme onlin bonu terbesar tanpa deposit
548,box savag brawler delet without look video roberto duran joe frazier mike tyson julio cesar chavez top head
549,وکیل رونالدو مقامات مالیاتی اسپانیا عدالتی کرده اند پرونده مسی کاملا متفاوت است
550,palestin oman today live stream result score channel info sports24houronlin
551,nba final talk wtf sport
552,american profession sport championship parad held weekday delet
553,soccer
554,perfect exampl espn becom anyon actual watch espn anymor outsid local team play prime time look like marcellu wiley argu anoth marcellu wiley fair sportsnat suppos seriou show fuck sportsnat comedi sport show meant analyt hate dissect championship game pre post pretti much nba exchang heard weekend morn weekend verbatim male anchor hey stat track show think closer 100 femal anchor well alway rang feel comfort give male anchor femal anchor well know simon barn focu becom catch mantra profession athlet link http phone espncricinfo com tcm content stori 1078605 html wow camera work amazingli bad like serious get three peopl face shot hell cours also way much go fuck place espn place score even soccer futbo report sever lack mandatori second ad video clip even one second long complet turn watch pti footbal season seem like wilbon becom grumpi old man know channel like watch give hint answer watch hope find someth complain other stop watch realist one way find sure one crack social media guru would abl investig espn cnn els noth els typic workout time school highli question tv stare alway play honestli made depress sport report chang use glu espn watch pti realli sad sport nation actual decent show first start sure cowherd ass beadl whatev fun see sport talk show revolv around opinion fan follow insuffer espn talk point person rout think even show question graph anymor need chang name either spn tmzspn drag westbrook mad said postul someon perspect opinion throw debat ye espn salti gong super team espn dan lebatard show radio good enough mnf yeah use watch time realiz wtf life watch espn year skip bayless nail coffin worst report ever lesse watch mike mike pti occasion watch sport center switch highlight analysi stand marbl mouth fuck cue card read women dress like club especi irrit attempt banter awkward unfunni outsid watch footbal still go eta espn want catch clue watch dan patrick colin cowherd show also bring back jim rome want bring back laker celtic awesom less sjw agenda race gender bait whine focu love sport watch sport talk sport get break world horseshit littl bit fine fuck got alreadi honestli think network still talk sport nhl network nfl network yesterday interview shareec wright took uber chicago buffalo went weigh competit light eddi laci weight loss incent use emoji describ team 2017 outlook seem like everi time mlb network clown fake classroom skit call lead anchor professor someth stupid stop watch espn year ago ever sinc continu renew highli question show liter exact thing everi singl day unbear fake humor espn concern report lebron headband steph curri sneaker actual sport espn alway way grow realli stand sport nation pti around horn scott van testiclehead highli question alright pleas stop complain get peopl hate espn news constantli whine make sub look like espn news feed fill non sport relat crap one want see use word salti jesu christ fair espn actual tongu cheek segment call way mani angl russel westbrook act petti sinc left sweati might tast realli salti took shower less make russ less salti lol cours lebron everyon leagu unless play warrior westbrook join cav reveng bitch yet still watch saltier russ might cabl tbh mind yea shit care enjoy sport shitti joke sinc kid alway espn background nois homework plow chick tri sleep etc grown colleg footbal season switch dish flex pack hardli watch could longer justifi 100 month someth bare watch anymor channel miss honestli daughter probabl stay netflix prime popcorn time watch monday night footbal still watch ryen russillo show watch block occasion alright end day sportscent fine everyth outsid straight trash think good job realli interest pop cultur meet sport vibe dan batard radio show thing watch watch pti daili also enjoy svp sportscent time time watch sport center get caught especi svp depend season go take even need highlight plenti youtub provid nope background stuff sole sec network watch alabama softbal basketbal gymnast mean fire marcellu wiley espn probabl came say love sportsnat reason good show younger teen adult arent necessarili steep sport news day light heart fun realli campi think characterist work well current format imagin took serious itd pile hot garbag good luck explain sub good one comedi unless box topic stop max put ball hoop time team better nba fuck salti dead sea like chill damn espn give soccer credit deserv one america major sport come back around espn treat soccer bare better poker bowl actual think would compliment lebron well use background nois mani person becam stage annoy part routin point fun bag espn lame show gotten liter unwatch pretti much colleg footbal tri direct yeah whole celebr gossip aspect kill espn omg beyond terribl comment last good show yep exactli problem major show like even sportscent get like watch right game give due seriou demograph person learn still daili half hour soccer show enough espn ml poker bowl nhl mean need network read celebr tweet get show pti decent show espn go yeah agre far say everi show devolv one way anoth dont realli watch cabl sport show channel year sinc havnt cabl frequent watch clip youtub follow favorit team news report differ platform late fs1 program much former espn person appeal obvious come inher issu feel like least theyr keep ground meme bullshit espn right one ml game everi sunday agre much would acknowledg soccer major sport top mental problem opinion old guard still look soccer someth deserv limit attent everi four year mental trickl realiz soccer becom state think fox much better job give sport respect believ deserv 100 right demograph issu sport amongst peopl 25ish trend continu soccer surpass basebal hockey els ask import question like butt hurt russel westbrook give shit get dad accent hillari dare group togeth realli get show like run joke show someth like show yeah run joke cowherd left replac lebatard area atroci show claim show broader stroke commentari outsid sport tri talk show sport interview thrown realiti garbag let rephras dan lebatard garbag stugotz greg codi could show want listen sport radio lunch break done past year find stuck jim rome cb sport radio much sport centric also think much promo rack whatev call talk sport holi shit hate rome love mid 20 mow terribl stupid stage call retard rant fuck one care idiot clone actual manag talk sport pretti smart funni guy rare yea heard stugotz show pretti good leberard laugh joke
555,canada curaçao live stream match broadcast channel info sports24houronlin
556,young penguin fan overwhelm get shirt sign sidney crosbi hilari awwww poor guy friend never let live girl shit togeth would flip kid drool
557,american profession sport championship parad held weekday delet assum whole citi wind
558,ارزشمندترین بازیکنان دنیا مشخص شدند نیمار صدر کین آلی بالاتر مسی رونالدو
559,newtodaynew com شاهد بالصور الفنانة ديانا حداد مكة بدون حجاب
560,nfl first femal player becca longo might year
561,ruta del sur 2017 etapa preview
562,coron inevit
563,первые внутренние детские соревнования naus
564,michael jordan shoe use 1984 olymp sell record price 190k
565,kevin durant 2017 nba final mvp caught gametim 2017
566,golden state warrior locker room win 2017 nba final delet
567,play whistl differ type
568,amaz oldest gymnast word johanna quaa
569,soccer
570,cristiano ronaldo charg tax evas delet
571,court make session last night game delet
572,lebron legaci final record intact isnt lebron dunk pizazz got height seem either tire sloppi deliv comparison also market geniu newer celeb half work get airtim definit air time jordan never play game final draft team stay titl sorri anoth team follow script lebron beat last think titl would meant lot stay cleveland whole time lebron mount rushmor mike sorri anoth team follow script lebron beat last question abil basketbal analyst think golden state follow lebron script never think leav compet front offic bull got pippen best player cav got lebron william much differ lebron left team coupl star what differ sorri hurt narr well one thing year golden state larg home grown team big three klay dray steph draft warrior year durant sign team come best regular season nba histori win final appear three star reign mvp beaten durant team lebron went miami went best regular season team leagu win cav middl road seed east heat wade homegrown heat star time mediocr udoni haslem second best talent roster member heat also join via free agenc reign mvp lebron yeah lebron also boston team block final later lebron went back cleveland also join bad team cav previou two season win season result two straight overal pick homegrown start team kyri irv point consid underachiev tristan thompson point thought blown pick well member cav big three came lebron sign cost cav two overal pick spur team kept titl far differ lebron two move durant similar sorri hurt narr question basketbal analysi abil lebron went miami anoth key piec draft believ argument goat tact particular follow lebron narr simpli true true say golden state draft built team lebron left garbag cle brought help whole rooki contract happen cle lebron left even name anyon team left team win away final championship calib team happen okc left still made playoff even leav leav team choke winningest team nba histori mvp dpoy alreadi titl without took easiest path possibl get titl yeah sorri actual agre tri say narr know built team ground except lebron built team miami jordan probabl felt way get ass beat piston celt excus even name anyon team quickli forget great like jamario moon boobi gibson leon pow hickson pretti ballsi disagre fact presid chanc gotcha disappoint see gsw much cop lebron time lebron almost help around great team long time get done think fantast player easili 2nd best much let like even want tri like said want beat lebron know go beat everi time unless goe luckili manag brought pippen help win cle bring yea one lebron dip jordan hof team stop frontin lebron left cleveland may still okc got ball roll jordan lot help either one point click wish lebron wait last word explain whole argument lot peopl say disagre great team star exist sinc 70 80 public star say need help etc magic kareem worthi bird mchale parish even duo shaq kobe stockton malon jordan never without pippen ad rodman think anyon got ball roll celtic truli form big lebron durant join team beat form team could compet give prop realli time wait consid play multipl year cav add bosh wade cleveland correct wade yet bosh believ sever overr lebron sure though
573,georg wallac tweet nba championship delet
574,شواین اشتایگر گواردیولا قدرت کنار گذاشتن نداشت روزهای سختی منچستر سپری کردم
575,أسرع طريقة لتكبير المؤخ صحية مائة بالمائة
576,goodby chicago scott darl rememb watch alfond amaz blow team got kick everyon knew pretti seriou issu kick glad end find success
577,cope sport
578,rank top ridicul talent team ever assembl
579,sam hinki sing welcom moana style sixer fan delet
580,messi duplic found iran
581,current amateur soccer team sponsor liquor store tie ml pro team unit fun stori team last amateur team left lamar hunt open cup tournament game plan typic occur minut match coach pick lineup base could get work show good stuff
582,enjoy scuba dive bali holiday low budget
583,newtodaynew com رئيس الإتحاد الأرجنتيني سامباولي أفضل مدرب بالعالم
584,shawn kemp would dunk cri babi player
585,miami dolphin player reefer
586,sincecam sc128pro sport action camera ambarella a12s75 soni imx117 switzerland
587,great sport moment might fix
588,أفضل المهارات حراس المرمى إذلال حراس المرمي
589,andrew mccutchen salut pittsburgh penguin box home run
590,paul perkin fantasi valu grow delet
591,unit gave stun goal amateur club open cup
592,kent state tyler heintz die workout
593,anoth wild sport far east delet
594,useless delet mp4 link http giphi com yzvkxbx6iard2 mp4 mp4 version time smaller gif beep bot faq http reddit com anti_gif_bot wiki index author http reddit com messag compos mrwasdennnoch sourc http github com wasdennnoch reddit anti gif bot
595,inevit declin socceroo coach
596,mob sport color ugli histori fox sport henri hill pictur activ member infam lucches crime famili 1970 help orchestr point shave scheme member boston colleg basketbal team slight factual correct henri hill never member associ connect guy scheme lucr high level protect
