,text
162,one saw anyth delet yeah funni craftsman tool best part end rais hand air signal beat next person pois full version non potato qualiti http www youtub com watch chxezuym6qg beat pose gymnast everi run show done potato qualiti funni rais hand sure http youtu fz21udkeq
163,ipl 2018 predict win time
164,miami saturday order play match point remov
165,account make nhl debut
166,villanova announv son flip car jail time could record clear delet
167,villanova announc son flip car jail time could record clear
168,daftar tim yang lolo piala dunia 2018
169,باشگاهها حضور بازیکنان جام جهانی چقدر درآمد کسب کنند
170,andrea barzagli discuss import milan juventu game remov
171,usual dubai broadcast someth see remov
172,death toll palestinian bloodiest protest rise seven
173,uci reject froom defens send case anti dope court
174,koora
175,bandar ceme onlin terbaik indonesia
176,nuevo video fcbutelevis youtub
177,burnley beat west brom saturday premier leagu matchup remov
178,citi tens top european club interest raheem sterl
179,richi rich casper know meme
180,live anthoni joshua joseph parker miss favorit fight show
181,قلعه نویی کاوه رضایی طارمی کدام لیگ لژیونر شدند
182,juventu potenti huge blow ahead game milan remov
183,prediksi juventu milan april 2018
184,part routin got katelyn ohashi third perfect delet taint hurt watch see advantag testicl strut end get hard like fuck diamond usernam check thicc pop split equival mic drop
185,wwe undertak funniest moment
186,watch live zlatan ibrahimov first press confer remov
187,agen bola verratti psg dibawah tekanan untuk mendapat gelar ligue1
188,prediksi chelsea tottenham hotspur april 2018
189,southampton beat west ham saturday premier leagu matchup remov
190,bottl kick monday brutal tradit two leictershir villag keg ale date 1000 year rule delet
191,prediksi sassuolo napoli maret 2018
192,player get put sleep rugbi leagu pretti sure saw soul leav bodi http www youtub com watch r8rh6kuuh6w drop hip low take contact guy brain got scrambl brain injuri get hit jason taumalolo soul leav bodi think said time mani yeah dude anyth ran right last minut thought shit plan got fell shadow realm rugbi leagu work look highlight reel peopl like jame graham sam burgess sonni bill william guy hit high tri win collis els wrap ball lower ball carrier offload panther player mistak win collis small commit also bear mind ball carrier jason taumalolo domin forward rugbi leagu current ten year contract good lol yeah probabl right redund help explain tri say run mawfucka face mani time go get exhaust
193,tiger wood call walk miracl master appear remov
194,oakland raider part way punter marquett king chucki king good punter
195,ml team worth nhl team orlando citi 490 million valuat la vega paid 500 million join nhl reportedli seattl pay 600 million littl background unawar happen past week investor bought minor stake florida base ml club orlando citi deal valu club 490 million orlando even one biggest club ml worth much imagin club like atlanta unit seattl sounder galaxi new york citi worth valuat orlando also rival mani team nhl present possibl ml catch rest major pro sport leagu america delet stadium huge part valu carolina panther go fetch astronom price land stadium valu highli right busi real estat worth busi rent delet would say difficult compar two sport although investor paid quit lot acquir minor stake orlando citi import note ml extrem high minimum salari floor like nhl otherwis put ml team take advantag leagu revenu share recuper money slowli invest minimum necessari make sure still attract fan exampl houston payrol last season lowest ml revenu 26m hand nhl team leagu impos salari floor 2017 reach regardless team profit put thing perspect even team highest payrol ml 2017 toronto nyc pay player 18m respect wherea competit nhl team like say boston bruin salari expenditur 83m season alon 60m differ yearli basi player salari alon add coach asst coach salari order sever million team expenditur might reach 100m somebodi acquir ml team 800m invest team next decad howev somebodi acquir nhl team like say vega golden knight 500m oblig invest minimum player salari alon sum might increas yearli basi consid cap limit floor yet project increas 2018 toronto would probabl hih valu club still worth point nhl revenu higher ml revenu despit ml big leagu 7th highest revenu footbal leagu world ranger canadien mapl leaf worth billion will bet bruin canuck red wing pretti close well exactli may buy know valuat go rise dictat market correct answer ml club valuabl nhl team overal nhl team averag valuabl toronto yeah probabl valu higher orlando consid market stadium field success popular growth potenti alway consid valuat someth still current valuat august forb valu galaxi 315million valuat buyer orlando seem gotten bad deal leagu go grow ml team sure continu grow valuat never see ml side worth top team nhl like leaf ranger deal sucha huge detail valu team ml club deal nhl team think averag ml club ever nhl club though honest soccer unfortun taken seriou enough north america tfc also own owner leaf mlse see money pump similarli raptor receiv mapl leaf treatment late apart plan make toronto major sport citi sport also like add jay own mlse leaf roger commun blue jay share mlse recent success somewhat ownership buy mental set forb valuat estim valu orlando citi 270m yet sold stake club valuat 490m similarli wealthi owner put kind money rapid own guy own ram arsen denver nugget colorado avalanch yet rapid one famous cheap club ml ye owner overpay franchis dictat market much franchis worth revenu orlando bring translat 490m valuat ml nowher near revenu stream nhl ultim decid valuat franchis stan kroenk count know first rule econom valu someth whatev peopl will pay like think econom valu quantifi absolut unambigu clark hunt owner chief dalla robert kraft pat rev ml owner realli dedic club happi ride wave ml growth enjoy invest appreci valu robert kraft better exampl big money owner team spread across countri even world differ ownership group like mlse sens pride citi even countri jay raptor canada team whatev make product good larg market also consid team own media compani cover push pressur make product worth watch differ leaf dire year peopl still watch play team like tfc raptor blue jay may see viewership attend play poor roger mlse dump cash well
196,krejcikova siniakova squeez past merten schuur miami final remov
197,premier leagu warn club anti extremist group
198,english duo content first major year remov
199,remind cord cutter final four nation championship cabl tb http wikipedia org wiki ncaa_march_madness_ cb turner start 2016 region final final four nation championship game began altern cb tb tb hold right final two round even number year cb get game odd number year nah ncaabballstream cabl compani must afraid live sport hold peopl pay cabl anymor would best way watch game plu els watch svu row follow big bang theori googl watch ncaa basketbal free reddit number link
200,mexican react canelo extend phantom suspens english sub caneloggg2
201,super skill
202,nba make space fan autism spectrum disord delet
203,anthoni joshua joseph parker weigh intens head head compl
204,philipp kyle guardiola compar walker lahm remov
205,four number seed women march madnass reach final four seed men march mad made final four said women unpredict delet
206,houston open ian poulter shoot round two climb leaderboard remov
207,bayern munich doctor slam guardiola remov
208,kevin durant explain love lavar ball parent style
209,incred goal taylor hall last night even impress slo stop muffin wobbl whole time
210,jess exe nintendo theme month april remov
211,account get call goal blackhawk goali injuri make save give goal balanc checkbook bet block shot
212,south african cricket fan give wound australian cricket team funni crowd earlier game chant captain
213,zheng yubo master world chines ball
214,annickakh ashlyn sydney leroux cassiu orlando pride remov
215,jame rodriguez want premier leagu move remov
216,أسطورة الأرجنتين يهاجم ميسي ويشيد رونالدو
217,reveal napoli target want stay man citi learn guardiola remov
218,podcast nhl nba playoff watch top olb 2018 nfl draft
219,fresh report suggest german coach psg remov
220,good motiv delet
221,mark hugh southampton boss say saint premier leagu posit baffl
222,jeff lorenzo review heat bull
223,mapleleafstextpost leaf compet masterchefauston judg favorit contest consist remov
224,louisvil footbal men basketbal women basketbal team season end mississippi state women basketbal http www espn com women colleg basketbal game gameid 401026258 mississppi state louisvil ncaat elit eight men basketbal http www espn com men colleg basketbal game gameid 401022812 mississippi state louisvil nit quarterfin footbal http www espn com colleg footbal game gameid 400953405 mississippi state louisvil taxslay bowlhail state game natti forget also footbal defens coordin trade made previou last year sirmon lvill grantham msst hail state repost sinc last one remov peter sirmon coordin trade make respons like dozen louisvil loss year
225,darrel klassen hit golf shot want control golf
226,transfer talk ronaldo demand real madrid sell isco keylor nava remov
227,univers louisvil footbal men women basketbal season end loss miss remov gave peter sirmon like dozen game lost mildlyinterest lol louisvil fan make pain chuckl better hot mess last year hope anyon better sirmon man aw gave 600 yard samford essenti personnel made top defens year
228,guardiola walker similar lahm abid remov
229,houston rocket head throne
230,lightweight champion toni cucuy ferguson action april 7th ufc win stoppag delet submit khabib fight style motherfuck khabib time know
231,watch joshua parker fight blog allow bot action perform automat pleas contact moder subreddit messag compos sport question concern
232,katelyn ohashi impress spilt bounc delet
233,katelyn ohashi split bounc delet
234,ben simmon pass ball ankl teammat delet
235,klopp reveal juventu real madrid target could yet stay liverpool remov
236,swimsuit tri shein prom dress success kinda
237,charli adam snu stiumul footbal warn legal high remov
238,speg gear cycl leg warmer
239,score damn perfect
240,toronto real salt lake altidor brace lift champion remov
241,arik ogunbowal game win shot beat undef uconn espn2 delet good holi shit hell shot great game http www reddit com sport comment 88g8ic arike_ogunbowale_gamewinning_shot_to_beat_th new thread dynasti
242,arik ogunbowal game win shot beat undef uconn huski espn2 impress uconn still abl get perfectli good shot attempt second left chang sooo quick wish shown second ogunbowal practic ran girl ball took like got even pass woman got ice vein shot well goe women tournament bracket cheer cheer old notr dame arik ogunbowal nail entir second half shot inbound shot clock expir miss two crucial free throw late overtim say made irish whoa happen damn nasti hell surpris coupl year back put perform wisconsin high school state championship unreal singlehandedli destroy team semi score point look like play half speed team championship impress live area game even high five wife emot game awesom see win proud girl one better game ncaa women ball geno bitter shoot though uconn almost forc anoth ladi conn kobe previous beat oppon like point one shot loss seem like poetic justic felt uconn run score congrat wettest shot american notr dame pronounc name french notr dame god fuck damnit think next shot go win one still great though serious one quickest releas dribbl ever seen rank 1st differ confer misunderstand geno salti usual person make incred run enjoy somebodi win team came reaallyy bench game winner fuck uconn fuck gino ariola damn gave chill lay watch fact uconn still almost tie second work crazi almost made look easi miss shot congrat notr dame congrat irish great game great season huski ogunbowal think name lol tell fundament ye laugh death snoo snoo god sweet pull jumper mean disrespect see mani femal basketbal player move dribbl shoot like male player impress lose everi five year due equal asid women basketbal one underwhelm mainstream sport wow sure women colleg basketbal fan excit drop dame women basketbal unwatch good tire uconn geno doesntwatchwomensncaaanywaylol notic teammat good job tri even get open wasnt carri lol women basketbal shame peopl game huge moment celebr noth near men basketbal edit guess get downvot think great moment reiter awesom huge moment women basketbal think great moment hope start even excit sport that never watch women sport event fuck frustrat resid happi see uconn women lose life win get want home cri lost eat gallon ice cream someth time that actual use thought exactli follow depress make complet time space yeah earth let put shot situat gabbi william best drew bree impress honestli extrem impress attempt smooth second prop though cours right right thought thing gimm got good look basket hell hurl floor know lmao delet wisconsin rais think miss two consecut free throw would pretti much seal game ice water ice water vein goe everyon appar build acknowledg post game interview rhyme boater game name virgin mari french priest found school 1842 terr daym rhyme game yea notr part would almost imposs american studi french pronounc french way french class american took 6month get somewhat decent french sound right hand accent problem real uconn get break pleas use lord name vain ncaa tournament four region separ bracket combin final four number one number seed region graphic use tournament seed also usual team name overal number one use game graphic uconn overal number one tournament realli make enjoy much person coach male would call driven desir win sinc coach women salti come remind bill belichek goal everi season win super bowl ncaa championship anyth less failur fuck enh rather watch basebal motor sport iron look downvot comment view women colleg ball distort bahahaha get vote laugh like play design basic pnr isol play corner give room work teammat clear much possibl bring hard doubl team want know exactli everyon rather look decid would slow arena sold exact thing happen men basketbal watch women sport event court length pass second left forc doubl miss previous also show sick shot way end regul think bell went ball left hand good attempt ball float littl lower time would perfect girl suppos guard busi celebr earli notic thing immedi circumst foul make last shot best case scenario block shot make worst case scenario foul make shot make one foul shot win game mean case keenum sure miss joke someth know meant chang scoreboard game end right wear uconn hat fuck frog smdh god fuck damn gloriou day may lord pleas misunderstand noth coach think belichek also super douch nugget think anyth male femal kind dickish lot comment interview use analog footbal way fun dabo swinney coach nick saban driven one allow person beyond sole focu win shine make one easier root import everyon know chud stand look pack peopl even true look like decent number empti seat end talk miss last shot fuck year old could made dumbass think first time heard someon call bell one player tip ball start clock probabl would intercept lower pass girl land final shot would turn one celebr earli gif fole actual huh thought butcher googl turn guy americanis pronunci know even throw coupl hell marri bitch alright reason coach like geno bill nick saban win much game earlier night salti louisvil fan left imposs complet full arena even men final four yeah nearli midnight lot louisvil msu fan left bruh men team miss open game winner time shot miss men okay iamverybadass could dumbass know think right delet thought refer inbound gabbi play part case keenum threw ball stefan digg nfc championship game differ case complet play victori gabbi receiv actual name school université notr dame lac everyon call notr dame inher tie togeth mani exampl coach success level funni interest entertain nice grumpi angri mold lmao guy head need notr dame hit deep take lead bree fole comparison mostli came fact two guy threw lot prayer pass last season realli pick somehow keenum work said receiv bail made catch often meanwhil gabbi william look least aim kia nurs fell defend got hand ball chanc pick instead tap ball straight samuelson get tip almost classic bree somehow put team posit win horsesho ass pass result int get let receiv end fun fact actual two lake school name lac lake father sorin arriv winter thought one lake ice snow melt realiz actual two lake decid screw lac sound better anyway mention john wooden arguabl greatest coach histori sport sort attitud shit yup know thought see reason continu hahaha true histori http magazin edu news one lake two stori
243,peculiar nine element ratio display
244,lacross ball collect tool
245,look john mcenro respons tenni star claim sport full lesbian epic remov
246,snu stiumul footbal warn legal high
247,uralochka dinamo kazan 2018 russian superleagu wome
248,reveal saudi arabia striker train man utd remov
249,kiss cam guy got excit everyon freak much almost seem stage still love let open bottl coke right frame camera next face keep open spray fake kiss cam crap get old guy red shirt start get spray start fuck stage pretti sure mani kiss cam footag hawk game stage fake gifv link http imgur com hfntkmw gifv bot faq http www reddit com livven wiki gifv bot code http github com livven gifvbot would someon coke fake news guy face hilari tho coke anthrax get excit kiss cam lead explos result stage fake funni lol look like spot kiss cam react yeah see guy wear redin back put hand arm rest prepar jump lot time home team mascot silli string pie fan attend don jersey visit oppon usual arena team employe pay sit seat get pie well genuin caught camera moment seem happen less plan advanc stage moment event noth els happen get see kiss cam see matter kiss cam whatev screen sport event jump nut point camera man wise switch yea get though still seem realli focus coke spray guy much kiss cam
250,نگاهی خودی لیگ برتر هفدهم خودزنی شلیک دروازه خودی
251,ronaldo absen kontra palma
252,amaz footbal skill trick 2018
253,transfer news rumour live chelsea push ahead man utd barca alderweireld remov
254,lebron jame pass full highlight pelican 2018 pt ast delet
255,chelsea wajib taklukkan spur
256,umpir joe west madison bumgarn intim stare delet joe west suck joe west know everyon paid ticket order see joe west turd joe west got like chin got dam like catcher like fuck go big countri bumgarn gonna back fat joe reason joe west said yanke sox game disgrac basebal take long wish turkey gizzard fuck would retir alreadi one lower lip fupa joe west piec shit explain uninform
257,premier leagu learn germani spain delet
258,enisey dinamo moscow 2018 russian superleagu women
259,miss favorit box show
260,prediksi skor getaf real beti april 2018 pertemuan seimbang
261,swing profil exclus golf train aid
262,footbal brand new singapor premier leagu readi kick footbal news top stori
263,
264,shaq spent 000 walmart card declin mayb transact block suspici activ edit read articl right giant bill walmart wtactualf shaq plot twist also tri buy remain unsold copi shaq heard kept hidden back shaq size stuff surpris walmart place long take put 000 worth merchandis back shelv kazaam got trade phoenix appart readi noth went walmart basic bought everyth need cloth underwear printer shit http streamabl com nrldj rent game back day new rent game convinc dad rent sega blockbust buddi sleepov tri convinc good game knew lie much buy cloth furnitur towel guess last one gob jerki god rememb game good way haha know stori end guy said shock part walmart carri shaq size cloth make feel littl sad fatass never find shot fit walmart
265,west indi announc squad pakistan
266,applic test make comeback agil devop team blog allow bot action perform automat pleas contact moder subreddit messag compos sport question concern
267,club footbal return long day gap
268,cr7
269,uconn women basketbal geno auriemma come grip consecut ncaa setback
270,wolv move closer premier leagu return despit red card
271,produc tell ref field court ice timeout take place nhl commerci determin game clock first whistl less less less ice call ice clean done break get rid snow build ice timeout base stoppag colleg basketbal instanc timeout first stoppag play foul shot game clock goe minut minut minut minut ref alreadi know time alway everi game nhl commerci determin game clock first whistl less less less ice call ice clean done break get rid snow build ice time first timeout way talk upstair red light penalti box nhl guy sidelin red glove nfl way time return play
272,let patriot march world remov
273,prediksi skor sevilla bayern munchen april 2018
274,третьего боя мма между расулом мирзаевым ержаном естановым будет
275,free cricket bet tip ipl bet tip 2018 cricket tip cbtf remov
276,short sleev jersey women soir
277,jame happi bayern remov
278,5th 8th lokomotiv fakel 2018 russia superliga men volley
279,popular pundit make worri predict tottenham game remov
280,poor man face deform footbal match sad delet
281,great tana umaga follow huge loss facial express realli reflect feel rugbi moment
282,final corinthian sesi 2017 brazil superliga men
283,report real allow isco leav remov
284,cara mudah cepat daftar taruhan judi sabung ayam
285,manli sea eagl canberra raider live watch sport live stream free
286,plessi steve harmison steve smith ball tamper
287,best ever notr dame thrill women final four win uconn histori irish finish job alway oversel everyth lost buzzer beater final four almost exactli way year ago love forget mississippi state beat overtim buzzer semi final game year irish inde even finish job done rest women colleg basketbal favor uconn lose final four fluke uconn lose two year row show rest countri realli beatabl make sport much excit next year love mississippi state got ass hand buzzer beater chick yeah buffalo bill 10 women colleg basketbal
288,semi final mina taubaté 2017 brazil superliga men
289,pep guardiola honest admiss possibl raheem sterl departur remov
290,stuart broad burst put england command new zealand dig go well ball plateau bit watl grandhomm partnership ball much hope wicket start tumbl morn 100 run lead would pretti good
291,yanke prospect look make opportun
292,vivo ipl 2018 royal challeng bangalor jersey shirt imag photo pictur
293,new nba intro donovan mitchel joel embiid victor oladipo
294,aw ankl break australian footbal
295,crystal palac liverpool team news clyne return start bench remov
296,jadwal live pertandingan liga champion april 2018
297,michael clark steve smith ball tamper verdict
298,liverpool crystal palac live stream predict score march 2018
299,jadwal live pertandingan liga europa april 2018
300,crystal palac liverpool english premier leagu live stream moha news
301,melbourn victori western sydney video highlight deng winner dramat victori win remov
302,ipl live stream remov
303,comedi footbal funniest moment 2018
304,savio real dress room unit stop win remov
305,rafa benitez admit surpris jamaal lascel comment newcastl unit takeov remov
306,bodybuild dealer launder cash made aladdin cave drug dozen bank account
307,nathan wheatley first fight back casey blair tonight
308,اهداف مباراة ليفربول وكريستال بالاس اليوم31 2018 وتألق محمد صلاح
309,февраля всемирный день больного
310,top global sport popular
311,west ham unit eye manchest unit keeper sam johnston replac joe hart report remov
312,jose mourinho insist manchest unit good posit remov
313,fernandodan terim şampiyonluk sözleri
314,расул мирзаев ержан естанов face face almati kazahstan
315,brock lesnar think mma fight wwe delet
316,أهداف مبارة ليفربوول كريستاال بلااس تألق محمد صللاح 2018
317,roma stutter nainggolan injur ahead barcelona clash remov
